address,name_legit,size_legit,nodes_legit,edges_legit,inst_count_legit,mnemonic_sha1_legit,disasm_sha1_legit,mnemonic_preview_legit,name_patched,size_patched,nodes_patched,edges_patched,inst_count_patched,mnemonic_sha1_patched,disasm_sha1_patched,mnemonic_preview_patched,_merge,classification,inst_delta,size_delta
4420978,?_Getcat@?$num_get@DV?$istreambuf_iterator@DU?$char_traits@D@std@@@std@@@std@@SAIPAPBVfacet@locale@2@PBV42@@Z_1,144.0,11.0,24.0,218.0,19235ccf58c9209a452d5024f828fcf525d7b7a2,39f17ed4f91b6c30146eda70a3e678f28add2997,jcnd jcnd jcnd goto jcnd push mov call mov xor mov test jz cmp jnz push call mov pop mov and test jz mov call push lea call inc mov and jmp xor mov test jz lea call push pop call retn und und und und und mov mov add ldx mov mov mov mov setz setp sets mov mov mov sub stx mov and mov mov setz setp sets mov mov mov mov ldx setb seto sub setz setp,?_Getcat@?$num_get@DV?$istreambuf_iterator@DU?$char_traits@D@std@@@std@@@std@@SAIPAPBVfacet@locale@2@PBV42@@Z_1,144.0,11.0,24.0,218.0,3c8f44b33c1665482e51d2d7a45ec2f360b3fe4d,7da31919d2ff1ff928639d1fe14d2429490d8e72,jcnd jcnd jcnd goto jcnd push mov call mov xor mov test jz cmp jnz push call mov pop mov and test jz mov call push lea call inc mov and jmp xor mov test jz lea call push pop call retn und und und und und mov mov add ldx mov mov mov mov setz setp sets mov mov mov sub stx mov and mov mov setz setp sets mov mov mov mov ldx setb seto sub setz setp,both,patched,0.0,0.0
4421082,?_Getcat@?$num_get@DV?$istreambuf_iterator@DU?$char_traits@D@std@@@std@@@std@@SAIPAPBVfacet@locale@2@PBV42@@Z_2,144.0,11.0,24.0,218.0,19235ccf58c9209a452d5024f828fcf525d7b7a2,7e08f4df47027641e80cd158cb603e91cb8e0560,jcnd jcnd jcnd goto jcnd push mov call mov xor mov test jz cmp jnz push call mov pop mov and test jz mov call push lea call inc mov and jmp xor mov test jz lea call push pop call retn und und und und und mov mov add ldx mov mov mov mov setz setp sets mov mov mov sub stx mov and mov mov setz setp sets mov mov mov mov ldx setb seto sub setz setp,?_Getcat@?$num_get@DV?$istreambuf_iterator@DU?$char_traits@D@std@@@std@@@std@@SAIPAPBVfacet@locale@2@PBV42@@Z_2,144.0,11.0,24.0,218.0,3c8f44b33c1665482e51d2d7a45ec2f360b3fe4d,8622d8e8b15cdfb0658223a32b9d0b8636e11d98,jcnd jcnd jcnd goto jcnd push mov call mov xor mov test jz cmp jnz push call mov pop mov and test jz mov call push lea call inc mov and jmp xor mov test jz lea call push pop call retn und und und und und mov mov add ldx mov mov mov mov setz setp sets mov mov mov sub stx mov and mov mov setz setp sets mov mov mov mov ldx setb seto sub setz setp,both,patched,0.0,0.0
4421186,?_Getcat@?$num_get@DV?$istreambuf_iterator@DU?$char_traits@D@std@@@std@@@std@@SAIPAPBVfacet@locale@2@PBV42@@Z_3,144.0,11.0,24.0,218.0,19235ccf58c9209a452d5024f828fcf525d7b7a2,0550ef095a7aa60b40c0bb40812cc2e0364e56a9,jcnd jcnd jcnd goto jcnd push mov call mov xor mov test jz cmp jnz push call mov pop mov and test jz mov call push lea call inc mov and jmp xor mov test jz lea call push pop call retn und und und und und mov mov add ldx mov mov mov mov setz setp sets mov mov mov sub stx mov and mov mov setz setp sets mov mov mov mov ldx setb seto sub setz setp,?_Getcat@?$num_get@DV?$istreambuf_iterator@DU?$char_traits@D@std@@@std@@@std@@SAIPAPBVfacet@locale@2@PBV42@@Z_3,144.0,11.0,24.0,218.0,3c8f44b33c1665482e51d2d7a45ec2f360b3fe4d,f19dcda3129894eb71187b4f077da216a44d81ce,jcnd jcnd jcnd goto jcnd push mov call mov xor mov test jz cmp jnz push call mov pop mov and test jz mov call push lea call inc mov and jmp xor mov test jz lea call push pop call retn und und und und und mov mov add ldx mov mov mov mov setz setp sets mov mov mov sub stx mov and mov mov setz setp sets mov mov mov mov ldx setb seto sub setz setp,both,patched,0.0,0.0
4421290,?_Getcat@?$numpunct@D@std@@SAIPAPBVfacet@locale@2@PBV42@@Z_0,196.0,17.0,32.0,255.0,0fd1c460d706ee9a3fd22790242a27e82594b441,b6e73701a86a06320643eb0bedc79ab4bb6422c2,jcnd jcnd jcnd goto jcnd push mov call mov xor mov test jz cmp jnz push call mov pop mov and test jz mov call push lea call and inc mov push push mov mov mov call jmp xor mov test jz lea call push pop call retn und und und und und mov mov add ldx mov mov mov mov setz setp sets mov mov mov sub stx mov and mov mov setz setp sets mov mov mov mov,"public: static unsigned int std::numpunct<char>::_Getcat(class std::locale::facet const near * near *,class std::locale const near *)",196.0,17.0,32.0,255.0,c8f0e43d73a523b2073a4cc54f26699ceef4b20d,056294605309ee640131b5045b7aa79b962808f8,jcnd jcnd jcnd goto jcnd push mov call mov xor mov test jz cmp jnz push call mov pop mov and test jz mov call push lea call and inc mov push push mov mov mov call jmp xor mov test jz lea call push pop call retn und und und und und mov mov add ldx mov mov mov mov setz setp sets mov mov mov sub stx mov and mov mov setz setp sets mov mov mov mov,both,patched,0.0,0.0
4421521,?_Getcat@?$time_get@GV?$istreambuf_iterator@GU?$char_traits@G@std@@@std@@@std@@SAIPAPBVfacet@locale@2@PBV42@@Z_0,173.0,14.0,28.0,222.0,eb6b10acda015b60517b2f4ad6466b13fda098e4,d6d4d77170574698a177859d67a205817d53dd6e,jcnd jcnd jcnd jcnd push mov call mov xor mov mov test jz cmp jnz push call pop mov mov test jz mov call push lea call mov inc push push mov mov call mov mov test jz lea call push pop call retn und und und und und mov mov add ldx mov mov mov mov setz setp sets mov mov mov mov sub stx mov and mov mov setz setp sets mov mov mov mov ldx setb seto,"public: static unsigned int std::time_get<unsigned short,class std::istreambuf_iterator<unsigned short,struct std::char_traits<unsigned short>>>::_Getcat(class std::locale::facet const near * near *,class std::locale const near *)",173.0,14.0,28.0,222.0,895130552c6e267ba709ee1ba1612dc3886a9f16,783532c858c063a7179045a682763afc79a411bf,jcnd jcnd jcnd jcnd push mov call mov xor mov mov test jz cmp jnz push call pop mov mov test jz mov call push lea call mov inc push push mov mov call mov mov test jz lea call push pop call retn und und und und und mov mov add ldx mov mov mov mov setz setp sets mov mov mov mov sub stx mov and mov mov setz setp sets mov mov mov mov ldx setb seto,both,patched,0.0,0.0
4421629,"public: static unsigned int std::time_put<unsigned short,class std::ostreambuf_iterator<unsigned short,struct std::char_traits<unsigned short>>>::_Getcat(class std::locale::facet const near * near *,class std::locale const near *)",142.0,10.0,22.0,203.0,f0cf0e394f061b7a70d812667d9af107bfd4299d,b0b2b09ad7cb4d9860e1bf9d94375b0471419f3d,jcnd jcnd jcnd jcnd push mov call mov xor mov mov test jz cmp jnz push call pop mov mov test jz mov call push lea call mov inc push push call mov mov test jz lea call push pop call retn und und und und und mov mov add ldx mov mov mov mov setz setp sets mov mov mov mov sub stx mov and mov mov setz setp sets mov mov mov mov ldx setb seto sub setz,"public: static unsigned int std::time_put<unsigned short,class std::ostreambuf_iterator<unsigned short,struct std::char_traits<unsigned short>>>::_Getcat(class std::locale::facet const near * near *,class std::locale const near *)",142.0,10.0,22.0,203.0,27d63261a5a0e03cf82b380e6b7ab546bb339ea8,f839aa8974079979e95265376a86767560056d88,jcnd jcnd jcnd jcnd push mov call mov xor mov mov test jz cmp jnz push call pop mov mov test jz mov call push lea call mov inc push push call mov mov test jz lea call push pop call retn und und und und und mov mov add ldx mov mov mov mov setz setp sets mov mov mov mov sub stx mov and mov mov setz setp sets mov mov mov mov ldx setb seto sub setz,both,patched,0.0,0.0
4421731,?_Getcat@?$time_put@GV?$ostreambuf_iterator@GU?$char_traits@G@std@@@std@@@std@@SAIPAPBVfacet@locale@2@PBV42@@Z_0,142.0,10.0,22.0,203.0,f0cf0e394f061b7a70d812667d9af107bfd4299d,300a27284132d9aed616c56f6804125dfd98c2f1,jcnd jcnd jcnd jcnd push mov call mov xor mov mov test jz cmp jnz push call pop mov mov test jz mov call push lea call mov inc push push call mov mov test jz lea call push pop call retn und und und und und mov mov add ldx mov mov mov mov setz setp sets mov mov mov mov sub stx mov and mov mov setz setp sets mov mov mov mov ldx setb seto sub setz,?_Getcat@?$time_put@GV?$ostreambuf_iterator@GU?$char_traits@G@std@@@std@@@std@@SAIPAPBVfacet@locale@2@PBV42@@Z_0,142.0,10.0,22.0,203.0,27d63261a5a0e03cf82b380e6b7ab546bb339ea8,a305a4ca2eb72b04cf48b9eff5c202a5e12de935,jcnd jcnd jcnd jcnd push mov call mov xor mov mov test jz cmp jnz push call pop mov mov test jz mov call push lea call mov inc push push call mov mov test jz lea call push pop call retn und und und und und mov mov add ldx mov mov mov mov setz setp sets mov mov mov mov sub stx mov and mov mov setz setp sets mov mov mov mov ldx setb seto sub setz,both,patched,0.0,0.0
4437584,"protected: void std::_Mpunct<unsigned short>::_Init(class std::_Locinfo const near &,bool)",240.0,13.0,30.0,393.0,3aa9c6a4e7ae88b10445243a5ac53c067e625d71,8c137e3d8f6c501ace6164582e00861f9ea50f09,jz goto jcnd goto jcnd jcnd jcnd goto push mov call mov mov lea push call push pop mov lea movsd call mov xor lea mov push mov mov mov push push mov call add mov mov push push call cmp jz mov jmp mov movsx mov test js cmp jl mov movsx lea push movsx mov push movsx push push call movsx lea push movsx push movsx push push mov call cmp jz mov mov mov call retn mov,"protected: void std::_Mpunct<unsigned short>::_Init(class std::_Locinfo const near &,bool)",240.0,13.0,30.0,393.0,3aa9c6a4e7ae88b10445243a5ac53c067e625d71,10f1905d51e6357f38065affd3109b54f736af20,jz goto jcnd goto jcnd jcnd jcnd goto push mov call mov mov lea push call push pop mov lea movsd call mov xor lea mov push mov mov mov push push mov call add mov mov push push call cmp jz mov jmp mov movsx mov test js cmp jl mov movsx lea push movsx mov push movsx push push call movsx lea push movsx push movsx push push mov call cmp jz mov mov mov call retn mov,both,patched,0.0,0.0
4437808,?_Init@?$_Mpunct@G@std@@IAEXABV_Locinfo@2@_N@Z_0,240.0,13.0,30.0,393.0,3aa9c6a4e7ae88b10445243a5ac53c067e625d71,6e16a9f0a8a43cd503ffeb35c3c8a0062d4e087c,jz goto jcnd goto jcnd jcnd jcnd goto push mov call mov mov lea push call push pop mov lea movsd call mov xor lea mov push mov mov mov push push mov call add mov mov push push call cmp jz mov jmp mov movsx mov test js cmp jl mov movsx lea push movsx mov push movsx push push call movsx lea push movsx push movsx push push mov call cmp jz mov mov mov call retn mov,?_Init@?$_Mpunct@G@std@@IAEXABV_Locinfo@2@_N@Z_0,240.0,13.0,30.0,393.0,3aa9c6a4e7ae88b10445243a5ac53c067e625d71,93f65035ec7043933a59fe34c68ec79230f17e07,jz goto jcnd goto jcnd jcnd jcnd goto push mov call mov mov lea push call push pop mov lea movsd call mov xor lea mov push mov mov mov push push mov call add mov mov push push call cmp jz mov jmp mov movsx mov test js cmp jl mov movsx lea push movsx mov push movsx push push call movsx lea push movsx push movsx push push mov call cmp jz mov mov mov call retn mov,both,patched,0.0,0.0
4438336,?_Init@?$time_get@GV?$istreambuf_iterator@GU?$char_traits@G@std@@@std@@@std@@IAEXABV_Locinfo@2@@Z_0,100.0,5.0,6.0,125.0,6c460d938706ba0aaf87b580c0929426b4fedddb,acf89e25c309ee48bb0138600711cfcdb27da459,goto push mov call mov mov push xor push mov mov mov mov call call mov call retn mov call xor push push call und und und und und mov mov mov mov sub stx mov mov add ldx nop push mov mov mov setz setp sets nop push mov mov mov add stx mov mov mov add stx mov mov mov add stx mov mov mov sub stx mov nop nop mov mov call mov nop nop mov mov,?_Init@?$time_get@GV?$istreambuf_iterator@GU?$char_traits@G@std@@@std@@@std@@IAEXABV_Locinfo@2@@Z_0,100.0,5.0,6.0,125.0,6c460d938706ba0aaf87b580c0929426b4fedddb,5b166a0f735b3ff6366d37ab17184a180210b14a,goto push mov call mov mov push xor push mov mov mov mov call call mov call retn mov call xor push push call und und und und und mov mov mov mov sub stx mov mov add ldx nop push mov mov mov setz setp sets nop push mov mov mov add stx mov mov mov add stx mov mov mov add stx mov mov mov sub stx mov nop nop mov mov call mov nop nop mov mov,both,patched,0.0,0.0
4440480,"private: static void std::locale::_Locimp::_Makeushloc(class std::_Locinfo const near &,int,class std::locale::_Locimp near *,class std::locale const near *)",1416.0,80.0,198.0,2386.0,0a62e68c7e0b63f41c306c2f27744433350f99b4,ed9cab050ef1ae398435909b3ada956c785d93b0,jcnd jcnd jcnd goto goto jcnd jcnd jcnd goto jcnd goto jcnd goto goto jcnd jcnd jcnd goto goto jcnd jcnd jcnd goto goto jcnd jcnd jcnd goto jcnd goto jcnd goto jcnd goto goto jcnd jcnd jcnd goto jcnd goto goto jcnd jcnd jcnd goto push mov call mov mov and push mov pop jz mov call cmp jnz push mov call mov mov pop test jz push mov mov mov call jmp mov push push push call add,"private: static void std::locale::_Locimp::_Makeushloc(class std::_Locinfo const near &,int,class std::locale::_Locimp near *,class std::locale const near *)",1416.0,80.0,198.0,2386.0,0a62e68c7e0b63f41c306c2f27744433350f99b4,8aac834dbe194957edccba62d668c0b724ed002d,jcnd jcnd jcnd goto goto jcnd jcnd jcnd goto jcnd goto jcnd goto goto jcnd jcnd jcnd goto goto jcnd jcnd jcnd goto goto jcnd jcnd jcnd goto jcnd goto jcnd goto jcnd goto goto jcnd jcnd jcnd goto jcnd goto goto jcnd jcnd jcnd goto push mov call mov mov and push mov pop jz mov call cmp jnz push mov call mov mov pop test jz push mov mov mov call jmp mov push push push call add,both,patched,0.0,0.0
4445936,"protected: virtual class std::basic_string<unsigned short,struct std::char_traits<unsigned short>,class std::allocator<unsigned short>> std::messages<unsigned short>::do_get(int,int,int,class std::basic_string<unsigned short,struct std::char_traits<unsigned short>,class std::allocator<unsigned short>> const near &)const",32.0,1.0,0.0,62.0,8124734f00a6819f36aa07f7140bf86393882254,0ed150425ec3ffb939308e674884a286b42a90ce,push mov push mov mov push and and call mov pop pop retn mov mov mov add ldx mov mov mov mov add ldx nop push mov mov add ldx mov and mov mov setz setp sets stx mov mov add ldx mov and mov mov setz setp sets stx mov nop nop mov mov call mov nop pop mov add icall,"protected: virtual class std::basic_string<unsigned short,struct std::char_traits<unsigned short>,class std::allocator<unsigned short>> std::messages<unsigned short>::do_get(int,int,int,class std::basic_string<unsigned short,struct std::char_traits<unsigned short>,class std::allocator<unsigned short>> const near &)const",32.0,1.0,0.0,62.0,8124734f00a6819f36aa07f7140bf86393882254,8e8d909e780b218f0275998aca6cc2fed0893193,push mov push mov mov push and and call mov pop pop retn mov mov mov add ldx mov mov mov mov add ldx nop push mov mov add ldx mov and mov mov setz setp sets stx mov mov add ldx mov and mov mov setz setp sets stx mov nop nop mov mov call mov nop pop mov add icall,both,patched,0.0,0.0
4445968,?do_get@?$messages@G@std@@MBE?AV?$basic_string@GU?$char_traits@G@std@@V?$allocator@G@2@@2@HHHABV32@@Z_0,32.0,1.0,0.0,62.0,8124734f00a6819f36aa07f7140bf86393882254,fa35bb298a7f5fa16ad5256e6a0646818f81fb8c,push mov push mov mov push and and call mov pop pop retn mov mov mov add ldx mov mov mov mov add ldx nop push mov mov add ldx mov and mov mov setz setp sets stx mov mov add ldx mov and mov mov setz setp sets stx mov nop nop mov mov call mov nop pop mov add icall,?do_get@?$messages@G@std@@MBE?AV?$basic_string@GU?$char_traits@G@std@@V?$allocator@G@2@@2@HHHABV32@@Z_0,32.0,1.0,0.0,62.0,8124734f00a6819f36aa07f7140bf86393882254,aef25ca3bc7503b55c5129d1ad91c12892e6fe56,push mov push mov mov push and and call mov pop pop retn mov mov mov add ldx mov mov mov mov add ldx nop push mov mov add ldx mov and mov mov setz setp sets stx mov mov add ldx mov and mov mov setz setp sets stx mov nop nop mov mov call mov nop pop mov add icall,both,patched,0.0,0.0
4447040,?do_get@?$num_get@DV?$istreambuf_iterator@DU?$char_traits@D@std@@@std@@@std@@MBE?AV?$istreambuf_iterator@DU?$char_traits@D@std@@@2@V32@0AAVios_base@2@AAHAAI@Z_0,67.0,1.0,0.0,132.0,456b6a5547e9784f46a3e548225611fa215f83fb,9e401cc60bb4a9613f0cecf1cd143be4a21045e0,push mov sub push lea push push lea push push push push push push call mov mov mov mov mov mov mov mov mov pop leave retn mov mov mov mov und und mov sub mov nop push mov mov add ldx nop push mov sub mov mov mov add ldx nop push mov mov add ldx nop push mov mov add ldx nop push mov mov add ldx nop push mov mov add ldx nop push nop push mov,"protected: virtual class std::istreambuf_iterator<char,struct std::char_traits<char>> std::num_get<char,class std::istreambuf_iterator<char,struct std::char_traits<char>>>::do_get(class std::istreambuf_iterator<char,struct std::char_traits<char>>,class std::istreambuf_iterator<char,struct std::char_traits<char>>,class std::ios_base near &,int near &,unsigned int near &)const",67.0,1.0,0.0,132.0,456b6a5547e9784f46a3e548225611fa215f83fb,783676e1ffae5cb9069d9f7c254957c817213e92,push mov sub push lea push push lea push push push push push push call mov mov mov mov mov mov mov mov mov pop leave retn mov mov mov mov und und mov sub mov nop push mov mov add ldx nop push mov sub mov mov mov add ldx nop push mov mov add ldx nop push mov mov add ldx nop push mov mov add ldx nop push mov mov add ldx nop push nop push mov,both,patched,0.0,0.0
4449280,?do_get@?$num_get@DV?$istreambuf_iterator@DU?$char_traits@D@std@@@std@@@std@@MBE?AV?$istreambuf_iterator@DU?$char_traits@D@std@@@2@V32@0AAVios_base@2@AAHAAG@Z_0,283.0,17.0,42.0,465.0,30d815c3aeed2c8128451864715ea3fb8eceb941,d849f29228b27d32929c8595d8df593f88b6e186,jcnd goto jcnd jcnd jcnd jcnd jcnd goto jcnd push mov call mov mov lea mov mov mov mov push mov call and lea push push lea push lea push lea push push call or lea add mov call mov test jnz mov xor mov mov jmp cmp lea setz jnz lea lea push push lea push push call mov mov add movzx mov mov cmp jz cmp jnz cmp ja cmp jz neg mov jmp mov mov lea push,"protected: virtual class std::istreambuf_iterator<char,struct std::char_traits<char>> std::num_get<char,class std::istreambuf_iterator<char,struct std::char_traits<char>>>::do_get(class std::istreambuf_iterator<char,struct std::char_traits<char>>,class std::istreambuf_iterator<char,struct std::char_traits<char>>,class std::ios_base near &,int near &,unsigned short near &)const",283.0,17.0,42.0,465.0,30d815c3aeed2c8128451864715ea3fb8eceb941,7af235ae895ab0e3dfbd7d4bc2ea7a8de1593fe2,jcnd goto jcnd jcnd jcnd jcnd jcnd goto jcnd push mov call mov mov lea mov mov mov mov push mov call and lea push push lea push lea push lea push push call or lea add mov call mov test jnz mov xor mov mov jmp cmp lea setz jnz lea lea push push lea push push call mov mov add movzx mov mov cmp jz cmp jnz cmp ja cmp jz neg mov jmp mov mov lea push,both,patched,0.0,0.0
4449520,?do_get@?$num_get@DV?$istreambuf_iterator@DU?$char_traits@D@std@@@std@@@std@@MBE?AV?$istreambuf_iterator@DU?$char_traits@D@std@@@2@V32@0AAVios_base@2@AAHAAI@Z_1,67.0,1.0,0.0,132.0,456b6a5547e9784f46a3e548225611fa215f83fb,18c965ad8f3669fc319bcf4d15651ba71ee641fe,push mov sub push lea push push lea push push push push push push call mov mov mov mov mov mov mov mov mov pop leave retn mov mov mov mov und und mov sub mov nop push mov mov add ldx nop push mov sub mov mov mov add ldx nop push mov mov add ldx nop push mov mov add ldx nop push mov mov add ldx nop push mov mov add ldx nop push nop push mov,?do_get@?$num_get@DV?$istreambuf_iterator@DU?$char_traits@D@std@@@std@@@std@@MBE?AV?$istreambuf_iterator@DU?$char_traits@D@std@@@2@V32@0AAVios_base@2@AAHAAI@Z_0,67.0,1.0,0.0,132.0,456b6a5547e9784f46a3e548225611fa215f83fb,3697a3eb82af200155e56b85df24fa59c5e88fc0,push mov sub push lea push push lea push push push push push push call mov mov mov mov mov mov mov mov mov pop leave retn mov mov mov mov und und mov sub mov nop push mov mov add ldx nop push mov sub mov mov mov add ldx nop push mov mov add ldx nop push mov mov add ldx nop push mov mov add ldx nop push mov mov add ldx nop push nop push mov,both,patched,0.0,0.0
4450016,?do_get@?$num_get@DV?$istreambuf_iterator@DU?$char_traits@D@std@@@std@@@std@@MBE?AV?$istreambuf_iterator@DU?$char_traits@D@std@@@2@V32@0AAVios_base@2@AAHAAM@Z_0,251.0,13.0,36.0,385.0,ea81ae546628adcd050751044225259442c184a0,912b2ef1d9f0abccab27491522f5c7c6c7695148,jcnd jcnd jcnd jcnd jcnd goto goto jcnd push mov sub mov xor mov mov lea push mov push mov push mov push push lea mov push lea push lea push push call add cmp jz lea push push lea push lea push call fstp fld lea add fst cmp jz cmp jnz mov cmp jz test jz shl push push fstp call pop pop fstp jmp fstp fldz mov jmp fstp lea push lea call test jz or mov,"protected: virtual class std::istreambuf_iterator<char,struct std::char_traits<char>> std::num_get<char,class std::istreambuf_iterator<char,struct std::char_traits<char>>>::do_get(class std::istreambuf_iterator<char,struct std::char_traits<char>>,class std::istreambuf_iterator<char,struct std::char_traits<char>>,class std::ios_base near &,int near &,float near &)const",251.0,13.0,36.0,385.0,ea81ae546628adcd050751044225259442c184a0,7167e92ae505f34724039108d303bbd9a4daf3c6,jcnd jcnd jcnd jcnd jcnd goto goto jcnd push mov sub mov xor mov mov lea push mov push mov push mov push push lea mov push lea push lea push push call add cmp jz lea push push lea push lea push call fstp fld lea add fst cmp jz cmp jnz mov cmp jz test jz shl push push fstp call pop pop fstp jmp fstp fldz mov jmp fstp lea push lea call test jz or mov,both,patched,0.0,0.0
4450272,?do_get@?$num_get@DV?$istreambuf_iterator@DU?$char_traits@D@std@@@std@@@std@@MBE?AV?$istreambuf_iterator@DU?$char_traits@D@std@@@2@V32@0AAVios_base@2@AAHAAN@Z_0,241.0,13.0,36.0,376.0,4d4be84d76274cd7ad584783308fbcdb534b2dcf,64e41c0842a5b54f7ab7214442985495fcfc305c,jcnd jcnd jcnd jcnd jcnd goto goto jcnd push mov sub mov xor mov mov lea push mov push mov push mov push push lea mov push lea push lea push push call add cmp jz lea push push lea push lea push call lea add fst cmp jz cmp jnz mov cmp jz test jz shl push push push fstp call add fstp jmp fstp fldz mov jmp fstp lea push lea call test jz or mov mov mov,"protected: virtual class std::istreambuf_iterator<char,struct std::char_traits<char>> std::num_get<char,class std::istreambuf_iterator<char,struct std::char_traits<char>>>::do_get(class std::istreambuf_iterator<char,struct std::char_traits<char>>,class std::istreambuf_iterator<char,struct std::char_traits<char>>,class std::ios_base near &,int near &,double near &)const",241.0,13.0,36.0,376.0,4d4be84d76274cd7ad584783308fbcdb534b2dcf,1f78246c0040eef7c30e3c48a9122d03ad64ea71,jcnd jcnd jcnd jcnd jcnd goto goto jcnd push mov sub mov xor mov mov lea push mov push mov push mov push push lea mov push lea push lea push push call add cmp jz lea push push lea push lea push call lea add fst cmp jz cmp jnz mov cmp jz test jz shl push push push fstp call add fstp jmp fstp fldz mov jmp fstp lea push lea call test jz or mov mov mov,both,patched,0.0,0.0
4450528,?do_get@?$num_get@DV?$istreambuf_iterator@DU?$char_traits@D@std@@@std@@@std@@MBE?AV?$istreambuf_iterator@DU?$char_traits@D@std@@@2@V32@0AAVios_base@2@AAHAAO@Z_0,65.0,1.0,0.0,132.0,51f9f6409e354e5290f3218ddbc902bc137448f7,bc57a564209f945524eb0e18666ab01d43ac22b1,push mov sub lea push push lea push push push push push push call fld mov mov mov mov fstp mov mov mov leave retn mov mov mov mov und und mov sub mov nop push mov mov add ldx nop push mov sub mov mov mov add ldx nop push mov mov add ldx nop push mov mov add ldx nop push mov mov add ldx nop push mov mov add ldx nop push nop push mov nop nop,"protected: virtual class std::istreambuf_iterator<char,struct std::char_traits<char>> std::num_get<char,class std::istreambuf_iterator<char,struct std::char_traits<char>>>::do_get(class std::istreambuf_iterator<char,struct std::char_traits<char>>,class std::istreambuf_iterator<char,struct std::char_traits<char>>,class std::ios_base near &,int near &,long double near &)const",65.0,1.0,0.0,132.0,51f9f6409e354e5290f3218ddbc902bc137448f7,71cef9e21eb1e7c43f2903f8023b15e741e159e6,push mov sub lea push push lea push push push push push push call fld mov mov mov mov fstp mov mov mov leave retn mov mov mov mov und und mov sub mov nop push mov mov add ldx nop push mov sub mov mov mov add ldx nop push mov mov add ldx nop push mov mov add ldx nop push mov mov add ldx nop push mov mov add ldx nop push nop push mov nop nop,both,patched,0.0,0.0
4450608,?do_get@?$num_get@DV?$istreambuf_iterator@DU?$char_traits@D@std@@@std@@@std@@MBE?AV?$istreambuf_iterator@DU?$char_traits@D@std@@@2@V32@0AAVios_base@2@AAHAAPAX@Z_0,242.0,12.0,26.0,383.0,88ff0e45e902033d34075c65f8587f571348a81e,d7af3d382c1dc30f5c3369980db4dedbcb8e759c,jcnd goto jcnd jcnd jcnd push mov call mov mov mov mov mov push mov lea call and lea push push lea push lea push lea push push call or lea add mov call cmp jnz mov mov and jmp lea push push lea push lea push call mov add mov lea cmp jz cmp jz mov and lea push lea call test jz or mov mov mov mov mov call retn und und und und und mov mov mov,"protected: virtual class std::istreambuf_iterator<char,struct std::char_traits<char>> std::num_get<char,class std::istreambuf_iterator<char,struct std::char_traits<char>>>::do_get(class std::istreambuf_iterator<char,struct std::char_traits<char>>,class std::istreambuf_iterator<char,struct std::char_traits<char>>,class std::ios_base near &,int near &,void near * near &)const",242.0,12.0,26.0,383.0,88ff0e45e902033d34075c65f8587f571348a81e,a7b04de57d4b0b58d49639969c0e0def23f7aad8,jcnd goto jcnd jcnd jcnd push mov call mov mov mov mov mov push mov lea call and lea push push lea push lea push lea push push call or lea add mov call cmp jnz mov mov and jmp lea push push lea push lea push call mov add mov lea cmp jz cmp jz mov and lea push lea call test jz or mov mov mov mov mov call retn und und und und und mov mov mov,both,patched,0.0,0.0
