address,name_legit,size_legit,nodes_legit,edges_legit,inst_count_legit,mnemonic_sha1_legit,disasm_sha1_legit,mnemonic_preview_legit,name_patched,size_patched,nodes_patched,edges_patched,inst_count_patched,mnemonic_sha1_patched,disasm_sha1_patched,mnemonic_preview_patched,_merge,classification,inst_delta,size_delta
4526545,public: static void Concurrency::details::SchedulerBase::ReturnSubAllocator(class Concurrency::details::SubAllocator near *),65.0,6.0,14.0,102.0,d3ca3da2e12a15ef3020c9bb29a4df0cc7d8dec1,1a40e6f422cd6b608812f694c05d3323d8992f3d,jcnd jcnd goto push mov push mov push cmp jz dec mov push call cmp jnb push push call jmp push mov call pop pop pop retn mov mov mov add ldx mov mov mov add ldx mov setb seto sub setz setp sets mov mov mov mov ldx mov setz setp sets mov mov nop push mov nop nop mov mov ldx icall mov mov setb seto sub setz setp sets mov mov lnot nop push nop push mov,public: static void Concurrency::details::SchedulerBase::ReturnSubAllocator(class Concurrency::details::SubAllocator near *),65.0,6.0,14.0,102.0,d3ca3da2e12a15ef3020c9bb29a4df0cc7d8dec1,bd3ae04c4efff340c0bcc5cd3e3bec07e8b7e964,jcnd jcnd goto push mov push mov push cmp jz dec mov push call cmp jnb push push call jmp push mov call pop pop pop retn mov mov mov add ldx mov mov mov add ldx mov setb seto sub setz setp sets mov mov mov mov ldx mov setz setp sets mov mov nop push mov nop nop mov mov ldx icall mov mov setb seto sub setz setp sets mov mov lnot nop push nop push mov,both,patched,0.0,0.0
4527099,private: static void Concurrency::details::SchedulerBase::StaticDestruction(void),121.0,9.0,16.0,126.0,c536ea3a9f60b6165574f97f662df51ae2e10146,b7cb940c211ca9176c4cb2c5377c626bd93923f1,jcnd goto jcnd push mov call mov mov call and sub jnz call mov jmp push mov call push call test jnz mov call retn und und und und und mov mov mov mov mov sub stx mov nop nop mov mov call mov mov sub ldx mov and mov mov setz setp sets stx mov mov ldx mov setb seto sub setz setp sets stx mov mov lnot mov nop nop mov mov call mov mov mov mov mov,private: static void Concurrency::details::SchedulerBase::StaticDestruction(void),121.0,9.0,16.0,126.0,c536ea3a9f60b6165574f97f662df51ae2e10146,4f08d51a5c3237c6e8dca53c9b44ac3751673dcf,jcnd goto jcnd push mov call mov mov call and sub jnz call mov jmp push mov call push call test jnz mov call retn und und und und und mov mov mov mov mov sub stx mov nop nop mov mov call mov mov sub ldx mov and mov mov setz setp sets stx mov mov ldx mov setb seto sub setz setp sets stx mov mov lnot mov nop nop mov mov call mov mov mov mov mov,both,patched,0.0,0.0
4527185,"protected: void Concurrency::details::SchedulerBase::Statistics(unsigned int near *,unsigned int near *,unsigned int near *)",316.0,16.0,50.0,701.0,582c950df9efeadc82de7a67344f69adda711cf9,035eb9fff3388a21d9feeaa3da59a2e435395b8e,jcnd jcnd jcnd jcnd jcnd jcnd jcnd jcnd jcnd jcnd push mov sub push push mov push xor mov mov cmp jle mov mov test jz and cmp jle mov lea push mov call mov test jz mov mov sub mov mov mov mov sub mov mov add sub mov add mov add inc lea cmp jl mov mov inc mov cmp jl mov xor mov sub mov mov mov sub mov mov add sub mov add mov add cmp,"protected: void Concurrency::details::SchedulerBase::Statistics(unsigned int near *,unsigned int near *,unsigned int near *)",316.0,16.0,50.0,701.0,582c950df9efeadc82de7a67344f69adda711cf9,594751a6d4fc3c97f5f1a24d861a4ae8f25bb753,jcnd jcnd jcnd jcnd jcnd jcnd jcnd jcnd jcnd jcnd push mov sub push push mov push xor mov mov cmp jle mov mov test jz and cmp jle mov lea push mov call mov test jz mov mov sub mov mov mov mov sub mov mov add sub mov add mov add inc lea cmp jl mov mov inc mov cmp jl mov xor mov sub mov mov mov sub mov mov add sub mov add mov add cmp,both,patched,0.0,0.0
4527501,private: void Concurrency::details::SchedulerBase::SweepSchedulerForFinalize(void),156.0,14.0,40.0,290.0,c9ae70245f8da1fd7e9a2d57b8885674940a64d8,3ea9aa02e15ef7211ff948b2416c78b3a7554ac5,jcnd jcnd jcnd goto jcnd jcnd jcnd jcnd push mov push push push push mov call mov mov pop test jz cmp jnz mov mov call mov push mov mov call mov call test jnz mov call jmp cmp jnz lea cmp jnz xor inc xchg lea mov mov mov and cmpxchg cmp jnz and mov push call cmp pop jnz mov call pop pop leave retn mov mov mov ldx nop push mov mov nop nop mov mov call,private: void Concurrency::details::SchedulerBase::SweepSchedulerForFinalize(void),156.0,14.0,40.0,290.0,91419f39f572d60066d5a3f5746a71325d8ae9e2,edc3be840b7e6bf087c67acb9e7a3b1ce99a2784,jcnd jcnd jcnd goto jcnd jcnd jcnd jcnd push mov push push push push mov call mov mov pop test jz cmp jnz mov mov call mov push mov mov call mov call test jnz mov call jmp cmp jnz lea cmp jnz xor inc xchg lea mov mov mov and cmpxchg cmp jnz and mov push call cmp pop jnz mov call pop pop leave retn mov mov mov ldx nop push mov mov nop nop mov mov call,both,patched,0.0,0.0
4528832,"public: void Concurrency::details::Hash<class Concurrency::details::_TaskCollection near *,class Concurrency::details::_TaskCollection near *>::Wipe(void)",77.0,9.0,26.0,205.0,79e8ce11915a63a768cf75cc34069b80620944ed,56dd0ea3ead21c3b61894fb207e9652a2147cbf4,jcnd jcnd jcnd jcnd jcnd push mov cmp jle push xor cmp jle push mov mov test jz mov push push call mov pop pop test jnz inc cmp jl pop mov and shl push push push call add pop pop retn mov mov mov add ldx mov setb seto sub setz setp sets mov mov xor or nop push mov mov mov setz setp sets mov mov ldx setb seto sub setz setp sets mov mov xor or nop,"public: void Concurrency::details::Hash<class Concurrency::details::_TaskCollection near *,class Concurrency::details::_TaskCollection near *>::Wipe(void)",77.0,9.0,26.0,205.0,79e8ce11915a63a768cf75cc34069b80620944ed,c8cf24b28d72e0b9e6ea676de05f6dd18cf4718c,jcnd jcnd jcnd jcnd jcnd push mov cmp jle push xor cmp jle push mov mov test jz mov push push call mov pop pop test jnz inc cmp jl pop mov and shl push push push call add pop pop retn mov mov mov add ldx mov setb seto sub setz setp sets mov mov xor or nop push mov mov mov setz setp sets mov mov ldx setb seto sub setz setp sets mov mov xor or nop,both,patched,0.0,0.0
4528962,sub_451B42,25.0,1.0,0.0,56.0,3e3d5015856c43988c9f63889972b057a416c8aa,2f976a738b9f0988a06449bc9f28739ece0b36c5,push mov push and and call mov mov pop pop retn mov mov nop push mov mov ldx mov and mov mov setz setp sets stx mov mov add ldx mov and mov mov setz setp sets stx mov nop nop mov mov call mov mov mov add stx mov nop pop nop pop mov icall,sub_451B42,25.0,1.0,0.0,56.0,3e3d5015856c43988c9f63889972b057a416c8aa,ab5231d17575a030008dd8cecaf7e5d7cb9b0ebb,push mov push and and call mov mov pop pop retn mov mov nop push mov mov ldx mov and mov mov setz setp sets stx mov mov add ldx mov and mov mov setz setp sets stx mov nop nop mov mov call mov mov mov add stx mov nop pop nop pop mov icall,both,patched,0.0,0.0
4528987,sub_451B5B,299.0,9.0,8.0,356.0,eb6da57bc5ec455e4b394b31667b3a03ee0382f4,3c6509ee702f4ab51c23cc584986672c9b252a93,push mov call push call pop pop retn push mov call mov mov mov lea or xor mov mov mov mov mov mov mov mov mov mov mov mov mov mov mov mov mov mov call mov lea mov mov mov mov push mov mov call lea mov call mov mov call mov mov push mov mov mov call mov call push push push mov call mov call retn mov retn und und und und und mov mov mov mov,sub_451B5B,299.0,9.0,8.0,356.0,eb6da57bc5ec455e4b394b31667b3a03ee0382f4,669bc9156aeb96a5cab8f479b629f5550942761a,push mov call push call pop pop retn push mov call mov mov mov lea or xor mov mov mov mov mov mov mov mov mov mov mov mov mov mov mov mov mov mov call mov lea mov mov mov mov push mov mov call lea mov call mov mov call mov mov push mov mov mov call mov call push push push mov call mov call retn mov retn und und und und und mov mov mov mov,both,patched,0.0,0.0
4529243,public: Concurrency::details::ContextBase::CancellationBeaconStack::~CancellationBeaconStack(void),60.0,7.0,18.0,136.0,70b5f1608931247eb68e64992540de7a8d331ac2,ad570ee82d3e5271cab5a8ecfb302cfc63fa6035,jcnd jcnd jcnd push mov cmp jle mov push mov test jz push push mov call push push call add mov test jnz pop pop push call pop pop retn mov mov mov add ldx mov setb seto sub setz setp sets mov mov xor or mov mov add ldx mov nop push mov mov ldx mov mov and mov mov setz setp sets mov mov nop push mov mov ldx nop push mov mov add ldx mov mov nop,public: Concurrency::details::ContextBase::CancellationBeaconStack::~CancellationBeaconStack(void),60.0,7.0,18.0,136.0,70b5f1608931247eb68e64992540de7a8d331ac2,48b7e09c6d87233d42043514a9ff6cd546164dfc,jcnd jcnd jcnd push mov cmp jle mov push mov test jz push push mov call push push call add mov test jnz pop pop push call pop pop retn mov mov mov add ldx mov setb seto sub setz setp sets mov mov xor or mov mov add ldx mov nop push mov mov ldx mov mov and mov mov setz setp sets mov mov nop push mov mov ldx nop push mov mov add ldx mov mov nop,both,patched,0.0,0.0
4529536,??_EScheduleGroup@Concurrency@@MAEPAXI@Z_4_1,35.0,3.0,6.0,58.0,4ed5f07527cfdf3ec96abb904c98c83a298e860c,0ec9ec4004b6667b61ee86f96814374bda5cde3c,jcnd push mov test push mov mov jz push push call pop pop mov pop pop retn mov mov mov add ldx mov and mov mov setz setp sets mov mov mov mov mov stx mov mov mov nop push nop push mov nop nop mov mov call nop pop nop pop mov nop pop mov add icall,??_EScheduleGroup@Concurrency@@MAEPAXI@Z_4_1,35.0,3.0,6.0,58.0,4ed5f07527cfdf3ec96abb904c98c83a298e860c,c27b4b54602989d3fe28b0131a8a4d31655e9b6c,jcnd push mov test push mov mov jz push push call pop pop mov pop pop retn mov mov mov add ldx mov and mov mov setz setp sets mov mov mov mov mov stx mov mov mov nop push nop push mov nop nop mov mov call nop pop nop pop mov nop pop mov add icall,both,patched,0.0,0.0
4529584,public: virtual void near * Concurrency::details::ContextBase::`scalar deleting destructor'(unsigned int),37.0,3.0,6.0,59.0,612b453d227cf30c4a771470e1bad733a5f9ad97,98a5a2bc379861c188dd888cd3960e6fd77c5604,jcnd push mov push mov call test jz push push call pop pop mov pop pop retn mov mov mov nop nop mov mov call mov mov add ldx mov and mov mov setz setp sets mov mov mov nop push nop push mov nop nop mov mov call nop pop nop pop mov nop pop mov add icall,public: virtual void near * Concurrency::details::ContextBase::`scalar deleting destructor'(unsigned int),37.0,3.0,6.0,59.0,612b453d227cf30c4a771470e1bad733a5f9ad97,7b1aad20090410beb5d021d77562a4bdf04cb736,jcnd push mov push mov call test jz push push call pop pop mov pop pop retn mov mov mov nop nop mov mov call mov mov add ldx mov and mov mov setz setp sets mov mov mov nop push nop push mov nop nop mov mov call nop pop nop pop mov nop pop mov add icall,both,patched,0.0,0.0
4529621,public: void near * Concurrency::details::WorkQueue::`scalar deleting destructor'(unsigned int),44.0,3.0,6.0,72.0,f2ff54b196652731eaad8273146277af1834578d,522a52ad9de969ab7b11573a282481a1b5c70a2e,jcnd push mov push mov lea call mov call test jz push push call pop pop mov pop pop retn mov mov mov add mov mov nop nop mov mov call mov mov nop nop mov mov call mov mov add ldx mov and mov mov setz setp sets mov mov mov nop push nop push mov nop nop mov mov call nop pop nop pop mov nop pop mov add icall,public: void near * Concurrency::details::WorkQueue::`scalar deleting destructor'(unsigned int),44.0,3.0,6.0,72.0,f2ff54b196652731eaad8273146277af1834578d,ce6ff6c269322e356dbca31f8b04fb8fd7dba7f5,jcnd push mov push mov lea call mov call test jz push push call pop pop mov pop pop retn mov mov mov add mov mov nop nop mov mov call mov mov nop nop mov mov call mov mov add ldx mov and mov mov setz setp sets mov mov mov nop push nop push mov nop nop mov mov call nop pop nop pop mov nop pop mov add icall,both,patched,0.0,0.0
4529665,public: int Concurrency::details::ListArray<class Concurrency::details::WorkQueue>::Add(class Concurrency::details::WorkQueue near *),354.0,26.0,78.0,795.0,e3ee0e56ed960f3b4aa911d224b6e626d640d8dc,c59428c2ea0888df7a814b0da8af60022cc1f68a,jcnd jcnd jcnd jcnd jcnd jcnd jcnd jcnd jcnd goto jcnd goto jcnd jcnd jcnd jcnd push mov sub push push mov mov push xor mov mov lea cmp jl mov xor mov cmp jle push pop cmp jnz mov lea mov mov mov mov mov xor cmpxchg mov test jz mov push pop inc add mov cmp jl lea cmp jnz push pop or cmpxchg add mov lea cmp jnz xor xor inc cmpxchg test jnz mov xor push,public: int Concurrency::details::ListArray<class Concurrency::details::WorkQueue>::Add(class Concurrency::details::WorkQueue near *),354.0,26.0,78.0,795.0,e3ee0e56ed960f3b4aa911d224b6e626d640d8dc,3b1362825e473ed27f93961098d8e385c51efe1f,jcnd jcnd jcnd jcnd jcnd jcnd jcnd jcnd jcnd goto jcnd goto jcnd jcnd jcnd jcnd push mov sub push push mov mov push xor mov mov lea cmp jl mov xor mov cmp jle push pop cmp jnz mov lea mov mov mov mov mov xor cmpxchg mov test jz mov push pop inc add mov cmp jl lea cmp jnz push pop or cmpxchg add mov lea cmp jnz xor xor inc cmpxchg test jnz mov xor push,both,patched,0.0,0.0
4530771,public: void Concurrency::details::ContextBase::CreateWorkQueue(void),168.0,13.0,28.0,253.0,c6a454ab197b0be262cb8f9184fcc5216cf85fc8,492f3083853253278c0d7d6cd978e8ac042750e4,jcnd jcnd jcnd jcnd goto push mov call mov mov call mov test jnz mov add push call xor mov test jz lea mov test jnz push call pop mov mov test jz mov call mov or mov jmp call mov mov add push call mov mov call retn und und und und und mov mov mov add ldx mov mov nop nop mov mov call mov mov mov add stx mov and mov mov setz setp sets mov mov,public: void Concurrency::details::ContextBase::CreateWorkQueue(void),168.0,13.0,28.0,253.0,c6a454ab197b0be262cb8f9184fcc5216cf85fc8,e90183838b6a7bbc8b10007b3838a45540cf207d,jcnd jcnd jcnd jcnd goto push mov call mov mov call mov test jnz mov add push call xor mov test jz lea mov test jnz push call pop mov mov test jz mov call mov or mov jmp call mov mov add push call mov mov call retn und und und und und mov mov mov add ldx mov mov nop nop mov mov call mov mov mov add stx mov and mov mov setz setp sets mov mov,both,patched,0.0,0.0
4531355,"public: bool Concurrency::details::Hash<class Concurrency::details::_TaskCollection near *,class Concurrency::details::_TaskCollection near *>::FindAndDelete(class Concurrency::details::_TaskCollection near * const near &,class Concurrency::details::_TaskCollection near * near *)",66.0,6.0,14.0,136.0,6f1101c483a62400e2d1987c9018c91eb43756bc,0977bf38a79bc894b07464bc910e43972b5fca4e,jcnd jcnd goto push mov push mov push push call pop pop push push mov call pop test jz mov test jz mov mov push push call pop pop mov jmp xor pop retn mov mov mov mov ldx nop push mov mov add ldx nop push mov nop nop mov mov call nop pop nop pop nop push mov mov add ldx nop push mov mov nop nop mov mov call nop pop mov and mov mov setz setp,"public: bool Concurrency::details::Hash<class Concurrency::details::_TaskCollection near *,class Concurrency::details::_TaskCollection near *>::FindAndDelete(class Concurrency::details::_TaskCollection near * const near &,class Concurrency::details::_TaskCollection near * near *)",66.0,6.0,14.0,136.0,6f1101c483a62400e2d1987c9018c91eb43756bc,f3e84beb6dca747435de5dd7018215bfbcc0f623,jcnd jcnd goto push mov push mov push push call pop pop push push mov call pop test jz mov test jz mov mov push push call pop pop mov jmp xor pop retn mov mov mov mov ldx nop push mov mov add ldx nop push mov nop nop mov mov call nop pop nop pop nop push mov mov add ldx nop push mov mov nop nop mov mov call nop pop mov and mov mov setz setp,both,patched,0.0,0.0
4532736,sub_452A00,31.0,3.0,6.0,62.0,0fcfc91b22cabd9218b1da1a2bf60732dd7b3200,f83551d2343aedf94ebe89a526ad72dadfe3d62e,jcnd push mov cmp jz mov call push push call pop pop pop retn mov mov mov add ldx mov setb seto sub setz setp sets mov mov mov mov add ldx mov mov nop nop mov mov call mov nop push mov mov add ldx nop push mov nop nop mov mov call nop pop nop pop nop pop mov icall,sub_452A00,31.0,3.0,6.0,62.0,0fcfc91b22cabd9218b1da1a2bf60732dd7b3200,befe4d9b27a6fe6e295a880232dbc5ee59d87fe5,jcnd push mov cmp jz mov call push push call pop pop pop retn mov mov mov add ldx mov setb seto sub setz setp sets mov mov mov mov add ldx mov mov nop nop mov mov call mov nop push mov mov add ldx nop push mov nop nop mov mov call nop pop nop pop nop pop mov icall,both,patched,0.0,0.0
4532772,public: void Concurrency::details::ContextBase::SweepAliasTable(void),130.0,10.0,28.0,237.0,a08987ee5823f7c74ba58860f97d3a9503607d76,58ffd3a0d53a506ac117c5c7a16610e1285abeda,jcnd jcnd jcnd jcnd jcnd push mov push push and lea push push lea push mov call mov test jz push mov test jnz inc lea push mov call mov mov call test jz mov mov call mov mov push lea push call test jz mov call push push call pop pop mov test jnz pop pop pop leave retn mov mov mov sub ldx mov and mov mov setz setp sets stx mov sub mov mov add mov nop,public: void Concurrency::details::ContextBase::SweepAliasTable(void),130.0,10.0,28.0,237.0,a08987ee5823f7c74ba58860f97d3a9503607d76,9219a0391642525526479990f8c58bc866db6254,jcnd jcnd jcnd jcnd jcnd push mov push push and lea push push lea push mov call mov test jz push mov test jnz inc lea push mov call mov mov call test jz mov mov call mov mov push lea push call test jz mov call push push call pop pop mov test jnz pop pop pop leave retn mov mov mov sub ldx mov and mov mov setz setp sets stx mov sub mov mov add mov nop,both,patched,0.0,0.0
4533359,"public: Concurrency::details::CancellationTokenRegistration_TaskProc::CancellationTokenRegistration_TaskProc(void (*)(void near *),void near *,int)",43.0,1.0,0.0,67.0,5e34719e35e3b9b629b91235222a314c6d150bc3,2f4c3d0aef3a15c79f10fccfe8b28851590d7b3a,push mov push push push mov mov call mov mov mov mov mov mov pop leave retn mov mov mov add ldx nop push mov mov mov mov sub stx mov nop nop mov mov call mov mov add ldx mov mov mov mov add stx mov mov add ldx mov mov mov mov add stx mov mov mov mov mov stx nop pop mov add icall,"public: Concurrency::details::CancellationTokenRegistration_TaskProc::CancellationTokenRegistration_TaskProc(void (*)(void near *),void near *,int)",43.0,1.0,0.0,67.0,5e34719e35e3b9b629b91235222a314c6d150bc3,3248ed30c74f2fd3f2ccf245b1eca336187cc0ee,push mov push push push mov mov call mov mov mov mov mov mov pop leave retn mov mov mov add ldx nop push mov mov mov mov sub stx mov nop nop mov mov call mov mov add ldx mov mov mov mov add stx mov mov add ldx mov mov mov mov add stx mov mov mov mov mov stx nop pop mov add icall,both,patched,0.0,0.0
4533408,sub_452CA0,27.0,1.0,0.0,36.0,7cdc622e276dfdc296644fcd288dc3f687f25e6a,711103c90861728aeadaea5559787b3a339de5e7,push mov push push mov call mov mov pop pop retn mov mov mov add ldx nop push mov mov nop nop mov mov call mov mov mov mov stx mov nop pop mov add icall,sub_452CA0,27.0,1.0,0.0,36.0,878ab058ad7d96989cb784f73d0c20e83ab8ff7d,9f8c88f79b718acdd2dbeb98e946785c9c4b301f,push mov push push mov call mov mov pop pop retn mov mov mov add ldx nop push mov mov nop nop mov mov call mov mov mov mov stx mov nop pop mov add ijmp,both,patched,0.0,0.0
4533680,sub_452DB0,27.0,1.0,0.0,36.0,7cdc622e276dfdc296644fcd288dc3f687f25e6a,35fe171dfbee3a51844c40b845dd7ebd1f2669e9,push mov push push mov call mov mov pop pop retn mov mov mov add ldx nop push mov mov nop nop mov mov call mov mov mov mov stx mov nop pop mov add icall,sub_452DB0,27.0,1.0,0.0,36.0,878ab058ad7d96989cb784f73d0c20e83ab8ff7d,960792783c79f97b473f0f18e4827784ea0c7214,push mov push push mov call mov mov pop pop retn mov mov mov add ldx nop push mov mov nop nop mov mov call mov mov mov mov stx mov nop pop mov add ijmp,both,patched,0.0,0.0
4533952,??_G?$_MallocaArrayHolder@PAVContext@Concurrency@@@details@Concurrency@@UAEPAXI@Z_0_0,44.0,3.0,6.0,75.0,ad82d67adf234b8d545754ab987a9e854a574eaa,62da517c37f06e8ab82f56a878128bd57fc618b1,jcnd push mov push mov push mov call test pop jz push push call pop pop mov pop pop retn mov mov mov mov add ldx nop push mov mov mov mov stx mov nop nop mov mov call mov mov add ldx mov and mov mov setz setp sets nop pop mov mov mov nop push nop push mov nop nop mov mov call nop pop nop pop mov nop pop mov add icall,??_G?$_MallocaArrayHolder@PAVContext@Concurrency@@@details@Concurrency@@UAEPAXI@Z_0_0,44.0,3.0,6.0,75.0,ad82d67adf234b8d545754ab987a9e854a574eaa,766583501ca06a35b9509ebf6feaeb98bc06a29e,jcnd push mov push mov push mov call test pop jz push push call pop pop mov pop pop retn mov mov mov mov add ldx nop push mov mov mov mov stx mov nop nop mov mov call mov mov add ldx mov and mov mov setz setp sets nop pop mov mov mov nop push nop push mov nop nop mov mov call nop pop nop pop mov nop pop mov add icall,both,patched,0.0,0.0
4534000,public: virtual void near * Concurrency::details::CancellationTokenRegistration_TaskProc::`scalar deleting destructor'(unsigned int),34.0,3.0,6.0,59.0,612b453d227cf30c4a771470e1bad733a5f9ad97,b06ce592ad4c7e2947267d6561921c360eba5445,jcnd push mov push mov call test jz push push call pop pop mov pop pop retn mov mov mov nop nop mov mov call mov mov add ldx mov and mov mov setz setp sets mov mov mov nop push nop push mov nop nop mov mov call nop pop nop pop mov nop pop mov add icall,public: virtual void near * Concurrency::details::CancellationTokenRegistration_TaskProc::`scalar deleting destructor'(unsigned int),34.0,3.0,6.0,59.0,612b453d227cf30c4a771470e1bad733a5f9ad97,f823576206efe21bceeb66f954af17dd8c626091,jcnd push mov push mov call test jz push push call pop pop mov pop pop retn mov mov mov nop nop mov mov call mov mov add ldx mov and mov mov setz setp sets mov mov mov nop push nop push mov nop nop mov mov call nop pop nop pop mov nop pop mov add icall,both,patched,0.0,0.0
4534034,public: void near * std::exception_ptr::`scalar deleting destructor'(unsigned int),114.0,7.0,10.0,103.0,7e3a89f6dd51ab86556206d8d6bd9947a01d74ba,097f66dafdde04d7f69b86b19b9b43fc8f1b88d4,jcnd push mov push push mov push push mov xor push lea mov mov and push call test pop jz push push call pop pop mov mov mov pop pop leave retn jmp mov mov mov und und und mov mov mov sub ldx mov and mov mov setz setp sets stx nop push mov nop nop mov mov call mov mov add ldx mov and mov mov setz setp sets nop pop mov mov mov nop push nop push,public: void near * std::exception_ptr::`scalar deleting destructor'(unsigned int),114.0,7.0,10.0,103.0,7e3a89f6dd51ab86556206d8d6bd9947a01d74ba,d669218f3ad3f51b5132601506fe65b5b3e3f6ee,jcnd push mov push push mov push push mov xor push lea mov mov and push call test pop jz push push call pop pop mov mov mov pop pop leave retn jmp mov mov mov und und und mov mov mov sub ldx mov and mov mov setz setp sets stx nop push mov nop nop mov mov call mov mov add ldx mov and mov mov setz setp sets nop pop mov mov mov nop push nop push,both,patched,0.0,0.0
4534151,public: class Concurrency::details::_TaskCollection near * Concurrency::details::ContextBase::GetArbitraryAlias(class Concurrency::details::_TaskCollection near *),98.0,7.0,18.0,177.0,93b3f51dc5a473798defd87ba0296239e2278943,478d4c5d2a0b3f65fd899a324f8892f486ba8fa4,jcnd goto jcnd jcnd push mov push push push lea push lea mov push call test jz mov jmp xor test jz mov shr test jz mov mov mov lea push push call mov call push push call pop pop xor pop mov pop leave retn mov mov add mov mov nop push mov add mov mov nop push mov nop nop mov mov call mov and mov mov setz setp sets mov mov mov mov add ldx mov mov,public: class Concurrency::details::_TaskCollection near * Concurrency::details::ContextBase::GetArbitraryAlias(class Concurrency::details::_TaskCollection near *),98.0,7.0,18.0,177.0,93b3f51dc5a473798defd87ba0296239e2278943,93ee2d4468d2bee0a9fa1cbb8c328afe0993d2a6,jcnd goto jcnd jcnd push mov push push push lea push lea mov push call test jz mov jmp xor test jz mov shr test jz mov mov mov lea push push call mov call push push call pop pop xor pop mov pop leave retn mov mov add mov mov nop push mov add mov mov nop push mov nop nop mov mov call mov and mov mov setz setp sets mov mov mov mov add ldx mov mov,both,patched,0.0,0.0
4534647,private: class Concurrency::details::_TaskCollection near * Concurrency::details::_TaskCollection::_Alias(void),172.0,13.0,32.0,241.0,7b75dab39726cab6641b5bbb57fe5573c63dea4c,d87f95ad90861f55c4ca7b9612a21d5cec8d2f60,jcnd jcnd goto jcnd jcnd jcnd jcnd push mov call mov call mov mov call cmp jnz cmp jnz mov jmp mov call test jz cmp jz push mov call test jnz push call pop mov xor mov test jz push push mov call mov or mov push push call mov call retn und und und und und mov mov nop nop mov mov call mov mov mov nop nop mov mov call mov mov add ldx mov setb seto,private: class Concurrency::details::_TaskCollection near * Concurrency::details::_TaskCollection::_Alias(void),172.0,13.0,32.0,241.0,7b75dab39726cab6641b5bbb57fe5573c63dea4c,0a4afe7830a206f69c060c6ff09ca18e7523e2fe,jcnd jcnd goto jcnd jcnd jcnd jcnd push mov call mov call mov mov call cmp jnz cmp jnz mov jmp mov call test jz cmp jz push mov call test jnz push call pop mov xor mov test jz push push mov call mov or mov push push call mov call retn und und und und und mov mov nop nop mov mov call mov mov mov nop nop mov mov call mov mov add ldx mov setb seto,both,patched,0.0,0.0
