address,name_legit,size_legit,nodes_legit,edges_legit,inst_count_legit,mnemonic_sha1_legit,disasm_sha1_legit,mnemonic_preview_legit,name_patched,size_patched,nodes_patched,edges_patched,inst_count_patched,mnemonic_sha1_patched,disasm_sha1_patched,mnemonic_preview_patched,_merge,classification,inst_delta,size_delta
4202704,sub_4020D0,59.0,3.0,6.0,112.0,ae5e44ba05406245021d6d532b555159d9e87be1,c78262b3ed94645b40fb06d0120909eef9be510d,jcnd mov mov mov mov und und mov mov mov sub stx mov mov mov setz setp sets mov mov lnot mov mov add ldx mov nop push mov mov sub ldx mov mov mov add ldx mov mov mov sub ldx mov mov mov add ldx mov mov mov ldx mov mov mov add ldx mov mov mov mov sub stx mov mov sub ldx mov mov nop nop mov mov ldx nop mov mov nop nop mov mov,sub_4020D0,220.0,33.0,68.0,122.0,b509a68e36dd3f1c46aa0f4b8f9624381fd7a330,f2f62a93fe710158454d213dda2d265d16ea80e4,jcnd goto mov mov call mov mov setb seto sub setz setp sets ext nop pop ldx add icall mov mov ldx cfadd ofadd add setz setp sets mov call mov retn into push and jle xor cmp movsd test shr cmpsb out fbstp shl outsd fidiv insb retn adc scasb add jz cli cmp insb retf adc js mov scasb jnz mov nop jno push cli scasb add jbe mov fcmovb loop clc adc scasb fcmovb lds jbe dec,both,patched,10.0,161.0
4234688,sub_409DC0,25.0,1.0,0.0,43.0,7e2ed907c244ee908c231754ccfcdf79d428266a,944869bee552c039d6543bb873012b0d39dc850e,push mov push mov mov push call add mov pop retn mov mov mov mov sub stx mov mov add ldx mov nop push mov nop nop mov mov call mov cfadd ofadd add setz setp sets mov nop pop mov add icall,sub_409DC0,119.0,22.0,46.0,53.0,6f8fe941af146a8cfdfa3faffb29fd0a96d0a5e8,2c35f5e2da4d52f53f7cee834731efda01aec479,pop push test retf mov std cli scasb add in sti call cmp inc int add cli scasb add jz cli push jnb ja insb fistp mov mov xchg enter mov jz cli push jnb ja insb mov add jz cli xchg das rol mov mov rcl jg leave cdq sti call add,both,patched,10.0,94.0
4198832,sub_4011B0,12.0,1.0,0.0,19.0,c423235315fe32c1fc6df965eafa1abed34b9766,da78b362a7e981d9ae20358959c092c7ac00dccb,mov nop push mov nop nop mov mov call nop pop nop pop mov icall push call pop retn,sub_4011B0,2.0,1.0,0.0,9.0,28eba9a553110fe6e57c0b87210e5ed0fca475f7,a66a14e88b97ecf3678cb88af5ddabb94a525fb4,goto ofadd add setz setp sets ext inc iret,both,patched,10.0,10.0
4349888,?_Copy@?$_Func_impl@V_lambda_57f1de56b929437c0a1ff5fbac1e1de9_@@V?$allocator@H@std@@X$$V@std@@EBEPAV?$_Func_base@X$$V@2@PAX@Z_1,32.0,1.0,0.0,54.0,0829fabe2f0f51410478a856cac6434dcd840976,691c12eec49f1bcb05633714868ef32f5c0ad975,push mov sub mov movzx push mov push mov call mov pop retn mov mov mov mov und und mov mov mov sub stx mov mov sub ldx xdu nop push mov mov add ldx mov nop push mov mov sub ldx mov mov nop nop mov mov call nop pop mov add icall,sub_425FC0,26.0,3.0,4.0,64.0,e142917415ced04ed87cffc0dac38f6e3fbd99f7,ce3cf7d5cecd53e27a577abff4dc5f3075513759,jcnd goto goto jz cli cmp shl test mov les mov lodsd retf mov mov call mov mov setb seto sub setz setp sets mov cfshl shl und setz setp sets mov mov and mov mov setz setp sets mov mov mov mov sub ldx mov add ldx mov mov mov stx mov mov ldx mov mov add nop pop ldx add add icall,both,patched,10.0,6.0
4205120,sub_402A40,22.0,1.0,0.0,36.0,99590004d0d5cb7e029bffe9f18e5d2e87bcd115,50e607f84d2e52698f853a260f4642631c5884ce,push mov push mov mov call mov mov pop retn mov mov mov mov sub stx mov mov sub ldx mov mov nop nop mov mov call mov mov add ldx mov nop pop mov icall,sub_402A40,10.0,3.0,4.0,28.0,19a378c8b1635b8994edfe0236e48691f644133d,7fa31ad59eb6ad92a55dd5a15cf7f894a1279031,jcnd goto goto jz cli xchg das rol insb retf mov mov call mov mov ldx mov ext cfshl mov mov und ext nop pop ldx add icall,both,patched,8.0,12.0
4240592,sub_40B4D0,22.0,1.0,0.0,36.0,48d7e3d8336872c80e3dbd12ec20db508ce73985,8db366137c138ca32579345a7268c26c5c420043,mov mov mov mov sub stx mov mov sub ldx mov mov nop nop mov mov call mov mov add ldx mov nop pop mov icall push mov push mov mov call mov mov pop retn,sub_40B4D0,10.0,3.0,4.0,28.0,12528a0c92a386134e4e90a97c34eaadb3e38c3b,83cd13cdaa789d51bd484ebc62d37da15af33ed2,jcnd goto goto mov mov call mov mov ldx mov ext cfshl mov mov und ext nop pop ldx add icall jz cli xchg das rol insb retf,both,patched,8.0,12.0
4554384,public: virtual void Concurrency::details::InternalContextBase::Free(void near *),44.0,1.0,0.0,59.0,dfe436847b3c7316b8647498f416b145631d31a6,cbfa84c590d2c18a4cd00610d8569313518c5830,push mov push mov call mov call push mov call mov call pop pop retn mov mov mov nop nop mov mov call mov mov add ldx mov mov nop nop mov mov call mov mov add ldx nop push mov mov nop nop mov mov call mov mov nop nop mov mov call nop pop mov add icall,public: virtual void Concurrency::details::InternalContextBase::Free(void near *),44.0,1.0,0.0,67.0,26c82e92a73c2eba7df8d461b8730b8420f38885,3f095636c04186e50d176b83ddcdaa238e538dc9,push mov push mov call mov call push mov call mov call pop pop retn nop push mov nop push mov mov nop nop mov mov call mov mov add ldx mov mov nop nop mov mov call mov mov add ldx nop push mov mov nop nop mov mov call mov mov nop nop mov mov call nop pop nop pop nop pop mov add icall,both,patched,8.0,0.0
4554560,public: virtual unsigned int Concurrency::details::InternalContextBase::GetVirtualProcessorId(void)const,47.0,4.0,8.0,69.0,afcbb3584de16454e0b786b240ab2b0a21226ec6,bdbf42c9107ad51d043904649d20494bcb61364e,jcnd goto push push mov call cmp jz mov mov jmp or mov call mov pop pop retn mov mov nop nop mov mov call mov mov add ldx mov setb seto sub setz setp sets mov mov mov mov add ldx mov mov mov add ldx mov mov mov mov or mov mov setz setp sets mov mov nop nop mov mov call mov nop pop mov icall,public: virtual unsigned int Concurrency::details::InternalContextBase::GetVirtualProcessorId(void)const,47.0,4.0,8.0,77.0,a1c28c8211de27fbbbfaf0884d20e3ee8b26d5e4,fa3507ebef911c89270d18b70849869bd7ae640e,jcnd goto push push mov call cmp jz mov mov jmp or mov call mov pop pop retn nop push nop push mov mov nop nop mov mov call mov mov add ldx mov setb seto sub setz setp sets mov mov mov mov add ldx mov mov mov add ldx mov mov mov mov or mov mov setz setp sets mov mov nop nop mov mov call mov nop pop nop pop nop pop mov icall,both,patched,8.0,0.0
4555777,sub_458401,31.0,2.0,2.0,38.0,59859c3c66df749449f67c41933b226ded9644d3,635bdd77b63ec23cbdd4e73b74e7ae675f344533,push mov push lea call push mov call pop lea pop jmp mov mov add mov mov nop nop mov mov call mov nop push mov mov nop nop mov mov call mov add mov mov mov call,sub_458401,31.0,2.0,2.0,46.0,7575de2175a7fd3e697c79efb28b06504c9047e7,e7cddac9973b263d8f69b0a18e6267985e41e24c,push mov push lea call push mov call pop lea pop jmp nop push mov nop push mov add mov mov nop nop mov mov call mov nop push mov mov nop nop mov mov call nop pop mov add mov nop pop mov mov call,both,patched,8.0,0.0
4212000,sub_404520,28.0,1.0,0.0,46.0,988121a5aa98fe675f0658678129d8667a86a9a7,a82d8ffcb99990e751f57a2d6e89b0a2b43dd4fd,push mov push mov mov call push mov call mov pop retn mov mov mov mov sub stx mov mov sub ldx mov mov nop nop mov mov call nop push mov mov sub ldx mov mov nop nop mov mov call nop pop mov icall,sub_404520,12.0,4.0,6.0,39.0,021b33022f526edfa0fe46b2ce65fde6318be86d,8e93fa7f10eae7fe0b0c2520458c68384f925724,jcnd goto jz cli xchg das rol insb retf add mov mov call mov mov ldx mov ext cfshl mov mov und ext nop pop ldx add icall mov mov ldx cfadd ofadd add setz setp sets mov call,both,patched,7.0,16.0
4200944,sub_4019F0,85.0,8.0,20.0,162.0,d901ef92df518a02b9262a5454489afd1a3c3d75,6eabefc9e1099f4927362b7f851e6c3022af621e,jcnd jcnd goto jcnd goto mov mov mov mov und und mov mov mov sub stx mov mov mov setz setp sets mov mov lnot mov mov mov mov sub stx mov sub mov nop push mov mov add ldx mov nop push mov sub mov nop push mov nop push mov mov add ldx mov nop push mov mov sub ldx mov mov mov ldx mov nop push mov nop nop mov mov ldx icall mov mov mov sub,sub_4019F0,67.0,4.0,6.0,156.0,c7adf5d71bb64693449de2465a4b56d7e9ded35f,61b2d075e5efe7b5ef9b09ae5230634dac0f7162,jcnd goto goto mov mov call mov mov setb seto sub setz setp sets ext mov mov sub ldx mov mov mov ldx mov mov stx mov add add mov mov ldx setb seto sub setz setp sets mov add ext mov mov ext ext mov xdu call seto sub setz setp sets mov mov add ldx ext xds mov mov ldx setb seto sub setz setp sets mov add ext mov xor mov mov setz setp sets mov mov,both,patched,6.0,18.0
4439167,sub_43BC7F,1423.0,80.0,198.0,2388.0,06fb3dd084a0ba05bb4a3b420fd713d0869e384f,3c0a61cb97177aebb6998fff43341ba0c5200f52,jcnd jcnd jcnd goto goto jcnd jcnd jcnd goto jcnd goto jcnd goto goto jcnd jcnd jcnd goto goto jcnd jcnd jcnd goto goto jcnd jcnd jcnd goto jcnd goto jcnd goto jcnd goto goto jcnd jcnd jcnd goto jcnd goto goto jcnd jcnd jcnd goto mov retn push mov call mov mov and push mov pop jz mov call cmp jnz push mov call mov mov pop test jz push mov mov mov call jmp mov push push push,sub_43BC7F,1433.0,82.0,202.0,2394.0,d88df13a3adb12daf7a015f1cadab60fd6436779,1044df462940b0fc728be58c246699cb4425dfc5,jcnd jcnd jcnd goto goto jcnd jcnd jcnd goto jcnd goto jcnd goto goto jcnd jcnd jcnd goto goto jcnd jcnd jcnd goto goto jcnd jcnd jcnd goto jcnd goto jcnd goto jcnd goto goto jcnd jcnd jcnd goto jcnd goto goto jcnd jcnd jcnd goto mov retn push mov call mov mov and push mov pop jz mov call cmp jnz push mov call mov mov pop test jz push mov mov mov call jmp mov push push push,both,patched,6.0,10.0
4319840,public: virtual void near * wxColourDialogEvent::`scalar deleting destructor'(unsigned int),46.0,3.0,6.0,84.0,28c47a21f03d027efa7954e19942417311b26a76,51582e32c9aec82290aa092cc9f512e3e5e55c26,jcnd push mov push mov mov call mov and jz push mov push call add mov mov pop retn mov mov mov mov sub stx mov mov sub ldx mov mov nop nop mov mov call mov mov add ldx mov mov and mov mov setz setp sets mov mov mov nop push mov mov sub ldx mov nop push mov nop nop mov mov call mov cfadd ofadd add setz setp sets mov mov mov sub ldx mov nop,sub_41EA60,38.0,3.0,4.0,90.0,8e06695d44989809a8fa4fd42406849ff3ec09cb,b00a51e445a1c26c7bb2c5005a6303e9861387cd,jcnd goto jz cli xchg das rol insb retf test call cwde call add xchg das rol insb retf mov mov call mov mov ldx mov ext cfshl mov mov und ext nop pop ldx add icall mov and mov mov setz setp sets mov nop nop mov nop nop mov mov icall xds mov nop nop mov nop nop mov mov icall mov add mov sub ldx cfadd ofadd add setz setp sets stx mov mov ldx mov ext,both,patched,6.0,8.0
4233728,sub_409A00,41.0,1.0,0.0,59.0,05105921310fbd815b3608a663412c2b7d3763a6,dbc7ec265bea91191cdac16929f31dcf2df5bf97,push mov sub mov mov mov mov mov mov mov mov pop retn mov mov mov mov und und mov mov mov sub stx mov mov sub ldx mov mov mov add ldx mov mov mov mov sub stx mov mov sub ldx mov mov mov mov mov add stx mov mov sub ldx mov nop pop mov icall,sub_409A00,20.0,6.0,12.0,64.0,64ab872804fb93ef9d0291d67f43e8ac8e3c3e91,c4aeb12d946dd12c8018f6b10eb6e8e96da6ebeb,jcnd goto jcnd goto jz cli cmp popf cmp retn jg cdq scasd push xchg mov mov call mov mov setb seto sub setz setp sets nop pop call mov mov setb seto sub setz setp sets nop pop mov add icall mov mov xor or lnot xds mov mov ldx setb seto sub setz setp sets mov add nop push mov mov mov,both,patched,5.0,21.0
4232912,sub_4096D0,23.0,1.0,0.0,35.0,919a6b77b8fcf21f5570c163b9e5fbf870a9640e,efd0e584d95cfd849293d7ae55a57c2aab7360fb,push mov push mov mov mov mov mov pop retn mov mov mov mov sub stx mov mov sub ldx mov mov mov mov mov stx mov mov sub ldx mov nop pop mov icall,sub_4096D0,16.0,6.0,10.0,40.0,cc40e98155d0022cc4a451ac84a97a8300334545,d7a6956f0c422f807ed007b8ea9f20d484d2cfb8,jcnd goto goto jcnd out jz cli xchg das rol retf ja retn mov call mov mov call mov mov ldx mov ext cfshl mov mov und nop pop ldx add icall mov mov or lnot nop pop mov icall,both,patched,5.0,7.0
4552912,public: virtual void near * Concurrency::details::InternalContextBase::Alloc(unsigned int),124.0,7.0,6.0,129.0,38c29aa71f12b991cb2fbd668c29caa55814f160,7ea087cc6692e5f9cc9247cefeee3471650e704f,push mov call mov lea neg sbb and mov mov call mov and call push mov call mov mov mov call mov call retn jmp und und und und und mov mov sub mov neg seto setnz setz setp sets xdu mov neg setz setp sets and mov mov setz setp sets mov mov mov mov sub stx mov nop nop mov mov call mov mov add ldx mov mov mov sub ldx mov and mov mov setz setp sets,public: virtual void near * Concurrency::details::InternalContextBase::Alloc(unsigned int),124.0,7.0,6.0,134.0,5e874cbdd8cf6f47f399eb4fc2aafe47478bb9b9,d3ff63376099bcd1a131ba1b9c396248b8d052d3,push mov call mov lea neg sbb and mov mov call mov and call push mov call mov mov mov call mov call retn jmp mov nop push mov mov und und und und und mov mov sub mov neg seto setnz setz setp sets xdu mov neg setz setp sets and mov mov setz setp sets mov mov mov mov sub stx mov nop nop mov mov call mov mov add ldx mov mov mov sub ldx mov and,both,patched,5.0,0.0
4233152,sub_4097C0,24.0,1.0,0.0,39.0,af8e51a3c51046331a863e0a344bc35fdb4920c5,0b5f3ea823b19b26f18a2959c9b5d8be2db2ab4b,push mov push mov mov mov mov mov mov pop retn mov mov mov mov sub stx mov mov sub ldx mov mov mov add ldx mov mov mov mov add stx mov mov nop pop mov add icall,sub_4097C0,23.0,7.0,10.0,43.0,d8e153bd5fca985f90b4b137a388c1871a1052ad,5085c11834e0b3bec7486dec59335b063b6fa6cb,jcnd goto jcnd goto goto out jz cli xchg das rol retf or retf ja retn mov call mov mov call mov mov ldx mov ext cfshl mov mov und nop pop ldx add icall mov mov or lnot nop pop mov icall,both,patched,4.0,1.0
4553466,sub_457AFA,27.0,2.0,2.0,34.0,31e41d3581d19bec4a9f4fbb1b4d0de66bff5439,76846847082c0fb56b2a6241c22c2f50b19769cd,push mov lea call mov call mov pop jmp mov mov add mov mov nop nop mov mov call mov mov nop nop mov mov call mov mov add ldx mov mov mov call,sub_457AFA,27.0,2.0,2.0,38.0,ecd00e41f71a6d8c2f49a3f62cb4ae82b1154a0b,4d86ae718990d777f0e3bffb5b2ef91cb0dca806,push mov lea call mov call mov pop jmp nop push mov mov add mov mov nop nop mov mov call mov mov nop nop mov mov call mov mov add ldx mov nop pop mov mov call,both,patched,4.0,0.0
4798592,sub_493880,15.0,1.0,0.0,19.0,8e63de282e30235e657edfecab16692892f7cf3b,6034c0132011c89a18c20bb3d717fcc1f4676ac1,mov mov mov mov nop nop mov mov call nop pop mov icall push mov mov call pop retn,sub_493880,15.0,1.0,0.0,23.0,62d9059f3f9a7dab7cda9b502219732a663c813f,09b2815a82bce19f9366eaab5bf8f3ccff680c43,nop push mov mov mov mov nop nop mov mov call nop pop nop pop mov icall push mov mov call pop retn,both,patched,4.0,0.0
4798656,sub_4938C0,15.0,1.0,0.0,19.0,8e63de282e30235e657edfecab16692892f7cf3b,cc15b7286875dc610317809b11d41a5852895d71,mov mov mov mov nop nop mov mov call nop pop mov icall push mov mov call pop retn,sub_4938C0,15.0,1.0,0.0,23.0,62d9059f3f9a7dab7cda9b502219732a663c813f,dec7037cb6226f3ca804b292fe455f2b99fa020f,nop push mov mov mov mov nop nop mov mov call nop pop nop pop mov icall push mov mov call pop retn,both,patched,4.0,0.0
4290528,??_GwxBitmapDataObject2@@UAEPAXI@Z_1,46.0,3.0,6.0,84.0,b115aa92ae596ea82281d1817f6e2c7c2fe0372f,354719e2bf9bf70bca4a06be286b051eb0befa3b,jcnd mov mov mov mov sub stx mov mov sub ldx mov mov nop nop mov mov call mov mov add ldx mov mov and mov mov setz setp sets mov mov mov nop push mov mov sub ldx mov nop push mov nop nop mov mov call mov cfadd ofadd add setz setp sets mov mov mov sub ldx mov nop pop mov add icall push mov push mov mov call mov and jz push mov push call add,sub_4177E0,159.0,16.0,32.0,81.0,8c37c0034c59b3f041296ba2ef9256eb04b5e910,3d707427df4a0de413cb01267541a3ebed3067b9,jz cli xchg das rol insb retf int enter xchg adc scasb add in sti call cmp xchg das rol mov push jnp fild cdq scasd into push jnp add icebp pop sbb cmp scasb xchg mov in sti call cmp xchg das rol mov push jnp fild cdq scasd into push jnp add xchg sahf pop mov daa rol les add in sti call cmp xchg das rol mov push jnp fxch7 cdq mov push jnp add lea aas,both,patched,3.0,113.0
4214800,sub_405010,15.0,1.0,0.0,25.0,05fe9c8471db9cadc48fd07926b02ba9f42277af,20d04a6a44c9b56098d55edc4eb8923bceae06cd,push mov push mov xor mov pop retn mov mov mov mov sub stx mov mov mov setz setp sets nop pop mov add icall,sub_405010,16.0,4.0,6.0,28.0,e00476c74cf34224a0ede6b1b739282afc6bd4c4,2d26994c111f95de6409bd9735a32162e5e44ef7,jcnd goto goto jz cli xchg das rcr fnstcw mov mov mov call mov mov ldx mov ext mov mov ldx ext stx mov mov mov stx call,both,patched,3.0,1.0
4214816,sub_405020,15.0,1.0,0.0,25.0,05fe9c8471db9cadc48fd07926b02ba9f42277af,1841fdadc6e835da426baa3b46cd0d59a186e86e,push mov push mov xor mov pop retn mov mov mov mov sub stx mov mov mov setz setp sets nop pop mov add icall,sub_405020,16.0,4.0,6.0,28.0,e00476c74cf34224a0ede6b1b739282afc6bd4c4,e7190292ea5d1e0932f2a771c64dbbab4c45c3bc,jcnd goto goto jz cli xchg das rcr fnstcw mov mov mov call mov mov ldx mov ext mov mov ldx ext stx mov mov mov stx call,both,patched,3.0,1.0
4214832,sub_405030,15.0,1.0,0.0,25.0,05fe9c8471db9cadc48fd07926b02ba9f42277af,e3afde959f0b6cde88e84fad7acb0f75176e4984,push mov push mov xor mov pop retn mov mov mov mov sub stx mov mov mov setz setp sets nop pop mov add icall,sub_405030,16.0,4.0,6.0,28.0,e00476c74cf34224a0ede6b1b739282afc6bd4c4,c46cdddac79df369839b5490ff43612addca2500,jcnd goto goto jz cli xchg das rcr fnstcw mov mov mov call mov mov ldx mov ext mov mov ldx ext stx mov mov mov stx call,both,patched,3.0,1.0
4214848,sub_405040,15.0,1.0,0.0,25.0,05fe9c8471db9cadc48fd07926b02ba9f42277af,7c32513993a96b4d9aeb79a6e685590c0109fff5,push mov push mov xor mov pop retn mov mov mov mov sub stx mov mov mov setz setp sets nop pop mov add icall,sub_405040,16.0,5.0,8.0,28.0,e00476c74cf34224a0ede6b1b739282afc6bd4c4,3857ed6f50abca63b6e686e839e7c0f1b4319536,jcnd goto goto jz cli xchg das rcr fnstcw mov mov mov call mov mov ldx mov ext mov mov ldx ext stx mov mov mov stx call,both,patched,3.0,1.0
4235040,sub_409F20,73.0,1.0,0.0,134.0,5e4d8cf6d7a6c91f8d6306dcac3d41011266a433,9cae14f53b83ab172fed1552a4fc1e2f0b4d7b81,push mov sub mov mov mov call mov mov call add push mov push mov push mov call mov or mov mov mov pop retn mov mov mov mov und und mov mov mov sub stx mov mov mov mov sub stx mov mov add ldx mov mov nop nop mov mov call mov mov mov sub stx mov mov add ldx mov mov nop nop mov mov call mov mov sub ldx cfadd ofadd add setz setp sets mov,sub_409F20,53.0,12.0,22.0,136.0,560391d9b461945783774925c253b5a8c7c83e5b,cd88f41afaec85d162b6343cfd6836c84fdc62af,jcnd jcnd jcnd goto jcnd goto jcnd jcnd goto goto goto goto fcmovb retn jz cli cmp aad adc hnt jle inc mov jnp jle hnt jbe push adc cmp cli scasb add lnot mov.fpu nop pop mov add icall mov mov call mov mov setb seto sub setz setp sets ext mov mov sub ldx xdu cfadd ofadd add cfadd ofadd or or add setz setp sets mov mov xor or ofadd add setz setp sets mov ext mov mov lnot,both,patched,2.0,20.0
4200672,sub_4018E0,19.0,1.0,0.0,30.0,4be9ed92d7493135bacd5b4bf245f3625df0b036,b063aaa5381c05b079b17ac58e0218c6ddde2417,mov mov mov mov sub stx mov mov sub ldx mov mov nop nop mov mov call nop pop mov icall push mov push mov mov call mov pop retn,sub_4018E0,10.0,3.0,4.0,28.0,12528a0c92a386134e4e90a97c34eaadb3e38c3b,c77dcfbe5f7d669597f13460a0f6386ec5e7f790,jcnd goto goto mov mov call mov mov ldx mov ext cfshl mov mov und ext nop pop ldx add icall jz cli xchg das rol insb retf,both,patched,2.0,9.0
4238608,sub_40AD10,19.0,1.0,0.0,30.0,4be9ed92d7493135bacd5b4bf245f3625df0b036,63730475fe581bd0afb91ff91ca15b9846eb792e,mov mov mov mov sub stx mov mov sub ldx mov mov nop nop mov mov call nop pop mov icall push mov push mov mov call mov pop retn,sub_40AD10,10.0,3.0,4.0,28.0,12528a0c92a386134e4e90a97c34eaadb3e38c3b,fd19ebd6483ea2f5c3363380f857db922d900187,jcnd goto goto mov mov call mov mov ldx mov ext cfshl mov mov und ext nop pop ldx add icall jz cli xchg das rol insb retf,both,patched,2.0,9.0
4290576,sub_417810,19.0,1.0,0.0,30.0,4be9ed92d7493135bacd5b4bf245f3625df0b036,fea11b7bd4718bdf1bff648c10e9546c5ec01ffd,mov mov mov mov sub stx mov mov sub ldx mov mov nop nop mov mov call nop pop mov icall push mov push mov mov call mov pop retn,sub_417810,10.0,3.0,4.0,28.0,12528a0c92a386134e4e90a97c34eaadb3e38c3b,541cb86e21a6af69a119a8d435d033f0bce30e8c,jcnd goto goto mov mov call mov mov ldx mov ext cfshl mov mov und ext nop pop ldx add icall jz cli xchg das rol insb retf,both,patched,2.0,9.0
4233664,sub_4099C0,25.0,1.0,0.0,36.0,8721e88ef303226fb011ff953915f81fe3d1462e,23abfaa773eca719bff2db12ef19182b592fc2bc,push mov push mov mov mov mov mov pop retn mov mov mov mov sub stx mov mov sub ldx mov mov mov add ldx mov mov mov mov add stx nop pop mov add icall,sub_4099C0,12.0,4.0,6.0,37.0,6b799ed62c72c7cc07ae8c090f4e1431f6ffb082,79fca1ccbeb9dfc5f8f42c5f0ac1d96c03837a86,jcnd goto goto jz cli xchg das rol retf add mov mov call mov mov ldx mov ext cfshl mov mov und nop pop ldx add icall mov mov ldx cfadd ofadd add setz setp sets mov,both,patched,1.0,13.0
4378176,sub_42CE40,360.0,16.0,50.0,536.0,4e2cf533497d950fd860d2bf107e6b1cd43be98a,f8e1b6c6943cec22efafaed7ffaf5f6d445e81d1,jcnd jcnd jcnd jcnd jcnd jcnd jcnd goto jcnd jcnd jcnd jcnd goto push mov sub mov xor mov mov push push mov mov push mov call test jz cmp jz push push call add cmp jz push push call mov add test jz push lea push push call push lea push lea push push call lea push push call mov add test jz xor mov add jz push push call add test jz push jmp push lea push push,sub_42CE40,360.0,16.0,50.0,535.0,758831647f58d4f181bc5f14c4fe3bf8f754cefb,97fa324d3e874eac0aedea188904edcbbf004218,jcnd jcnd jcnd jcnd jcnd jcnd jcnd goto jcnd jcnd jcnd jcnd push mov sub mov xor mov mov push push mov mov push mov call test jz cmp jz push push call add cmp jz push push call mov add test jz push lea push push call push lea push lea push push call lea push push call mov add test jz xor mov add jz push push call add test jz push jmp push lea push push call,both,patched,1.0,0.0
4383920,sub_42E4B0,721.0,22.0,48.0,1184.0,249c99d8509389d99ea9667342113cf4764f951b,513d02f1f68c099c952f40f8c28fb239e18f7652,jcnd jcnd jcnd jcnd jcnd goto goto jcnd goto push mov push push mov push sub push push push mov xor push lea mov mov mov mov call mov sub sar mov mov call mov mov call mov lea call mov mov sub sar mov call mov lea push lea push call add cmp jz mov lea call mov mov call mov lea push lea push call mov add shr mov sub cmp ja mov lea inc cmp cmovb push,sub_42E4B0,721.0,22.0,48.0,1183.0,a7eaaff8323ab5c9739a715d20453539e79467e0,455f094f27ddad4f525b533066610c7729f67143,jcnd jcnd jcnd jcnd jcnd goto goto jcnd push mov push push mov push sub push push push mov xor push lea mov mov mov mov call mov sub sar mov mov call mov mov call mov lea call mov mov sub sar mov call mov lea push lea push call add cmp jz mov lea call mov mov call mov lea push lea push call mov add shr mov sub cmp ja mov lea inc cmp cmovb push mov,both,patched,1.0,0.0
4385005,"public: struct HINSTANCE__ near * near & ATL::CSimpleArray<struct HINSTANCE__ near *,class ATL::CSimpleArrayEqualHelper<struct HINSTANCE__ near *>>::operator[](int)",37.0,4.0,8.0,75.0,efb4b7a33f68422e8d7ad538d48c6471176df611,e4c3022cd983afffe62e13ca94552e90516cae65,jcnd jcnd goto push mov mov test js cmp jge mov lea pop retn push push call int mov mov mov add ldx mov mov and mov mov setz setp sets mov mov mov mov add ldx mov setb seto sub setz setp sets mov mov xor lnot mov mov ldx mov mov mul add mov nop pop mov add icall mov nop push mov nop push mov nop nop mov mov call mov call,"public: struct HINSTANCE__ near * near & ATL::CSimpleArray<struct HINSTANCE__ near *,class ATL::CSimpleArrayEqualHelper<struct HINSTANCE__ near *>>::operator[](int)",37.0,4.0,8.0,74.0,5e4ee225ff341284996f81016185e026fd94721b,bbd374c805066228c11e20bf67e375d3a31f2a7c,jcnd jcnd push mov mov test js cmp jge mov lea pop retn push push call int mov mov mov add ldx mov mov and mov mov setz setp sets mov mov mov mov add ldx mov setb seto sub setz setp sets mov mov xor lnot mov mov ldx mov mov mul add mov nop pop mov add ijmp mov nop push mov nop push mov nop nop mov mov call mov call,both,patched,1.0,0.0
4387726,"class std::num_get<char,class std::istreambuf_iterator<char,struct std::char_traits<char>>> const near & std::use_facet<class std::num_get<char,class std::istreambuf_iterator<char,struct std::char_traits<char>>>>(class std::locale const near &)",208.0,13.0,22.0,271.0,2c4e98b2dcc5bef8f8704784545285d8894a2eb0,d3c06eeb2d5de9993359cd3921a92b44e092c692,jcnd jcnd goto jcnd goto push mov call push lea call mov mov and mov call mov push call mov test jnz test jz mov jmp push lea push call pop pop cmp jz mov mov push mov call mov pop mov mov call mov call mov lea call mov call retn lea call push lea push call und und und und und mov nop push mov sub mov mov nop nop mov mov call mov mov ldx mov mov,"class std::num_get<char,class std::istreambuf_iterator<char,struct std::char_traits<char>>> const near & std::use_facet<class std::num_get<char,class std::istreambuf_iterator<char,struct std::char_traits<char>>>>(class std::locale const near &)",208.0,13.0,22.0,270.0,7edf6e38f7d9a60908a14b68ed7db536f87413d6,763653a2b728cc7158b9e7d826d8b5d72f0f7365,jcnd jcnd goto jcnd push mov call push lea call mov mov and mov call mov push call mov test jnz test jz mov jmp push lea push call pop pop cmp jz mov mov push mov call mov pop mov mov call mov call mov lea call mov call retn lea call push lea push call und und und und und mov nop push mov sub mov mov nop nop mov mov call mov mov ldx mov mov mov,both,patched,1.0,0.0
