address,name_legit,size_legit,nodes_legit,edges_legit,inst_count_legit,mnemonic_sha1_legit,disasm_sha1_legit,mnemonic_preview_legit,name_patched,size_patched,nodes_patched,edges_patched,inst_count_patched,mnemonic_sha1_patched,disasm_sha1_patched,mnemonic_preview_patched,_merge,classification,inst_delta,size_delta
4744096,sub_4863A0,8714.0,262.0,666.0,9452.0,86264974cfd0c638956d73fdaa17b1a42c15b1da,93e01d1a2341f6498eeec5b6da554ded04895710,jcnd jcnd goto jcnd goto jcnd jcnd goto jcnd goto jcnd jcnd goto jcnd goto jcnd jcnd jcnd jcnd jcnd jcnd jcnd jcnd goto jcnd goto jcnd jcnd goto jcnd goto jcnd jcnd jcnd goto jcnd jcnd jcnd goto jcnd jcnd jcnd goto jcnd jcnd jcnd jcnd jcnd jcnd goto jcnd goto jcnd jcnd goto jcnd goto jcnd jcnd goto jcnd goto jcnd jcnd jcnd goto jcnd goto jcnd jcnd jcnd jcnd jcnd goto jcnd jcnd jcnd goto jcnd goto,sub_4863A0,8803.0,274.0,690.0,1856.0,c72b18122af5c96938047db80dc03c3ca5859dd5,c3615a3e5db8a7698ff87bcfe8ba926deaf0d9bc,jz cli mov adc popa scasd jb scasb fcmovb lds cli test fisttp scasd jz cli mov xor scasb fcmovb lds scasd stosb xor sbb lahf pop jnp xchg jnp les pop xor retn xor xchg retn push mov push push mov push sub mov xor mov push lea mov mov mov push lea call mov mov mov push push call mov call mov push lea call mov push lea call mov mov push lea call mov push lea call,both,patched,7596.0,89.0
4761744,sub_48A890,3336.0,89.0,214.0,3599.0,b66811d373d4f05c4fc64328b4bd11cdd7bdbd81,04ba1694c5575a13225865530ac09cf65e956996,jcnd jcnd goto jcnd goto jcnd jcnd goto jcnd jcnd jcnd goto jcnd goto jcnd goto jcnd goto jcnd goto jcnd goto jcnd jcnd goto jcnd jcnd jcnd jcnd jcnd goto jcnd jcnd goto jcnd jcnd jcnd goto jcnd mov mov mov mov und und mov mov und und und mov mov mov sub stx mov mov mov mov sub stx mov nop push mov sub mov mov nop nop mov mov call mov mov mov mov sub stx mov,sub_48A890,3384.0,98.0,232.0,742.0,7c70e4cb3a7640d36c10af7114e4b192da33edef,40d99e33fa6d02ba4e3f2660850a48b268e54ab6,jz cli mov xor scasb fcmovb lds scasd stosb xor sbb lahf pop jnp jz cli mov adc popa scasd jb scasb fcmovb lds cli push mov push push mov push sub mov xor mov push lea mov mov mov push lea call mov mov call test jnz call test jz mov push lea call mov mov mov mov mov or mov push push push lea push push mov call push call add mov jmp mov mov mov and jz,both,patched,2857.0,48.0
4442144,"private: class std::ostreambuf_iterator<unsigned short,struct std::char_traits<unsigned short>> std::money_put<unsigned short,class std::ostreambuf_iterator<unsigned short,struct std::char_traits<unsigned short>>>::_Putmfld(class std::ostreambuf_iterator<unsigned short,struct std::char_traits<unsigned short>>,bool,class std::ios_base near &,unsigned short,bool,class std::basic_string<unsigned short,struct std::char_traits<unsigned short>,class std::allocator<unsigned short>>,unsigned short)const",1473.0,103.0,288.0,2632.0,646fb56380c8eb225d7419307a82caef33429c95,2f857503b933de98a5b40218a4d0c6b89cc6853e,jcnd goto jcnd goto jcnd jcnd jcnd jcnd jcnd jcnd jcnd jcnd jcnd goto jcnd goto jcnd jcnd jcnd jcnd jcnd jcnd goto jcnd goto goto goto goto jcnd jcnd jcnd jcnd jcnd jcnd goto jcnd jcnd jcnd goto jcnd jcnd jcnd jcnd jcnd goto jcnd jcnd goto jcnd jcnd goto jcnd jcnd goto jcnd jcnd goto jcnd goto jcnd jcnd jcnd jcnd push mov call mov mov mov movzx mov movzx mov mov push and lea call cmp jz,sub_43C820,1589.0,119.0,324.0,521.0,9104cf8a9ccf3ef4fbd4913bf3cefd6998c66482,53d9a0d6693d6d320f292c788de0d2ba0fe23d3b,push mov call mov mov mov movzx mov movzx mov mov push and lea call cmp jz lea mov push call mov mov jmp lea mov push call mov mov pop lea mov call mov mov lea push mov call mov call mov mov call cdq mov xor sub mov cmp ja push mov lea sub inc push push call jmp cmp lea jb mov cmp jz cmp lea jb mov cmp jle mov call cmp lea movzx jb mov,both,patched,2111.0,116.0
4443523,?_Putmfld@?$money_put@GV?$ostreambuf_iterator@GU?$char_traits@G@std@@@std@@@std@@ABE?AV?$ostreambuf_iterator@GU?$char_traits@G@std@@@2@V32@_NAAVios_base@2@G1V?$basic_string@GU?$char_traits@G@std@@V?$allocator@G@2@@2@G@Z_0,1473.0,103.0,288.0,2632.0,646fb56380c8eb225d7419307a82caef33429c95,79570ede318e924a7b91fcb60b5e2cf8ef6584a2,jcnd goto jcnd goto jcnd jcnd jcnd jcnd jcnd jcnd jcnd jcnd jcnd goto jcnd goto jcnd jcnd jcnd jcnd jcnd jcnd goto jcnd goto goto goto goto jcnd jcnd jcnd jcnd jcnd jcnd goto jcnd jcnd jcnd goto jcnd jcnd jcnd jcnd jcnd goto jcnd jcnd goto jcnd jcnd goto jcnd jcnd goto jcnd jcnd goto jcnd goto jcnd jcnd jcnd jcnd push mov call mov mov mov movzx mov movzx mov mov push and lea call cmp jz,sub_43CD83,1589.0,119.0,324.0,521.0,9104cf8a9ccf3ef4fbd4913bf3cefd6998c66482,eddcb4bff041595851d86941ff390b0b91d8822d,push mov call mov mov mov movzx mov movzx mov mov push and lea call cmp jz lea mov push call mov mov jmp lea mov push call mov mov pop lea mov call mov mov lea push mov call mov call mov mov call cdq mov xor sub mov cmp ja push mov lea sub inc push push call jmp cmp lea jb mov cmp jz cmp lea jb mov cmp jle mov call cmp lea movzx jb mov,both,patched,2111.0,116.0
4765408,sub_48B6E0,2565.0,44.0,72.0,2484.0,c8de07725a41896c02f1a6fd23ed65e05e397232,d1f6b59e5bea728ba57b0aa3be087420cd984ec8,mov mov mov mov und und mov mov und und und mov mov mov sub stx mov mov sub ldx mov mov nop nop mov mov call mov mov mov mov sub stx mov mov sub ldx mov mov mov mov mov stx mov mov sub ldx mov mov mov mov mov add stx mov nop push mov sub mov mov nop nop mov mov call mov mov mov mov sub stx mov mov mov mov sub stx mov mov,sub_48B6E0,2565.0,44.0,72.0,526.0,774bb21e3d3ed624a952e7fa9bf21de58b2c3e17,df73e134e22e7834808467817480bcb066c31c5e,push mov push push mov push sub mov xor mov push lea mov mov mov call mov mov mov mov mov push lea call mov mov mov lea push lea push lea call mov lea call push lea call mov mov mov lea push lea push lea call mov lea call push lea call mov mov mov lea push lea push lea call mov lea call push lea call mov mov mov lea push lea push lea call mov lea,both,patched,1958.0,0.0
4767520,sub_48BF20,1473.0,1.0,0.0,2331.0,27d88bdf5d1da8c16ed9eff676db98e76f5c67dc,baac31a020053bfade68cc23087755816ca91360,mov mov mov mov und und mov mov mov sub stx mov mov sub ldx mov mov nop nop mov mov call mov mov mov mov sub stx mov mov mov mov sub stx mov mov sub ldx mov nop push mov mov sub ldx mov nop push mov mov sub ldx mov nop push mov sub mov nop push mov nop nop mov mov call mov mov mov ldx mov mov mov mov stx mov mov add ldx mov,sub_48BF20,1473.0,1.0,0.0,458.0,aaa62c1734940ca7e05a2356df24a0a47a0d8826,05d83bd0017f526edfe4420cadfcc70c220f1d76,push mov sub mov mov call mov mov mov push mov push mov push lea push call mov mov mov mov mov mov mov mov mov push lea call push push lea call push lea push call add push push lea call push lea push call add push push push lea call push lea push call add mov mov mov mov mov mov mov mov mov mov mov mov call mov mov mov push mov push mov push lea push,both,patched,1873.0,0.0
4741984,sub_485B60,1496.0,48.0,104.0,1595.0,bd769fc17f3c23cbf824fc06eb9a9408f42a9694,ea1983ea5e360f1250808b79b064d77bcaf84246,jcnd jcnd goto jcnd goto jcnd goto jcnd goto jcnd goto jcnd goto jcnd goto jcnd goto jcnd goto goto jcnd jcnd mov mov mov mov und und mov mov und und und mov mov mov sub stx mov mov mov mov sub stx mov sub mov mov nop nop mov mov call mov mov mov mov sub stx mov mov mov mov sub stx mov mov mov mov sub stx mov nop push mov nop push mov nop nop,sub_485B60,1496.0,48.0,104.0,324.0,cef014f013a7e62bc0c6203c77c6e6733fff5fcd,2923c6b0d3f2a099328174742ba22c9c1540c56a,push mov push push mov push sub mov xor mov push lea mov mov mov lea call mov mov mov push push call mov call mov lea push push push mov push push call mov cmp jz call test jz mov push lea call mov mov mov mov mov or mov mov push mov push push push push lea push push mov call push call add mov jmp mov mov mov and jz and lea call mov jmp push lea,both,patched,1271.0,0.0
4755136,sub_488EC0,1233.0,43.0,112.0,1364.0,b701d2cfbc39887881609a86152acdd42f31264e,9642d111214c8ab4e6ffe60f2b986b8456489db4,jcnd jcnd goto jcnd jcnd jcnd goto jcnd goto jcnd goto jcnd goto jcnd jcnd goto jcnd goto jcnd goto jcnd jcnd jcnd goto jcnd jcnd mov und und und und und mov mov und und und mov mov mov sub stx mov mov mov mov sub stx mov mov mov mov sub stx mov mov mov mov sub stx mov nop push mov nop push mov sub mov nop push mov nop nop mov mov call mov cfadd ofadd,sub_488EC0,1233.0,43.0,112.0,262.0,5e701bfb3e2cd85a2988bd868494cf1145caa22c,05df63217aa1cad99dccb5400207e5160a60a45b,push mov push push mov push mov call mov xor mov push lea mov mov mov mov mov push push lea push call add mov mov mov cmp jnz push push call mov call mov lea push push push mov push push call mov cmp jz mov jmp lea push lea push lea push push push mov push call mov cmp jnz cmp jz cmp jz jmp push lea push call add mov cmp jnz jmp xor mov mov lea,both,patched,1102.0,0.0
4740432,sub_485550,1020.0,38.0,88.0,1041.0,8804c4659e0dd01cd2b955799ec390c5b90c3c23,882df4969d037c24ff268d648914c9545c9c1c64,jcnd jcnd jcnd jcnd jcnd goto jcnd jcnd goto jcnd goto jcnd jcnd goto jcnd mov mov mov mov und und mov mov und und und mov mov mov sub stx mov mov mov mov sub stx mov nop push mov sub mov mov nop nop mov mov call mov mov mov mov sub stx mov nop push mov nop push mov nop nop mov mov call mov mov nop nop mov mov call nop push mov sub mov mov,sub_485550,1101.0,47.0,106.0,258.0,37f7c35b15b1f87344607fe37c23aa7f5718ea4f,f8c0aa041ec5f245846c0ac6ccf8245736e8ac2d,jz cli mov adc popa scasd jb scasb fcmovb lds cli dec mov xor retn mov add add cli into outsd xchg rol mov xchg inc cmp mov fcmovb jz push mov cli scasb add aad scasd pop xchg push mov push push mov push sub mov xor mov push lea mov mov mov push lea call mov push push call mov call push lea call mov lea call movzx test jnz push lea call mov lea push push push,both,patched,783.0,81.0
4379680,sub_42D420,33.0,3.0,6.0,56.0,1225468e93c6ceaa3e45a7a13c2281e11439c2f0,b4a4cbb687afe842bca233cabc6026007079ccc9,jcnd push mov mov test jz push call add mov mov pop retn mov mov mov add ldx mov mov and mov mov setz setp sets mov mov nop push mov nop nop mov mov call mov cfadd ofadd add setz setp sets mov mov mov mov mov add stx mov mov nop pop mov icall,sub_42D420,265.0,27.0,62.0,692.0,cfddcc17677cb1afde76ecb4e8bdb4ecf21d0c1c,8cbf5cbe22b67e11f1150a6a61ad007c85312b4e,jcnd jcnd jcnd jcnd jcnd jcnd jcnd jcnd jcnd goto jcnd jcnd jcnd goto jcnd jcnd jcnd goto jcnd jnz jcnd jcnd goto goto goto sbb push pop mov stosb sub sal nop retf adc sahf outsd test movsb mov js pop sbb retf mov cdq scasd pop or scasd shr jp mov movsd scasd into mov inc dec push jge cmp mov fcmovb jz lodsd lea jg jnb fist dec dec test jle mov rcl js mov scasb fcmovb,both,patched,636.0,232.0
4318592,sub_41E580,313.0,18.0,54.0,660.0,109a89a75f349bddf8adcbadd715b46ca7daa883,490a0441a72912e33fe8c1dfb5979020ed8967fa,jcnd jcnd jcnd jcnd jcnd jcnd jcnd jcnd jcnd goto jcnd goto goto push mov sub mov mov mov mov mov cmp jl jg cmp jbe mov call mov mov cmp jl jg cmp jbe mov cmp jg jl mov cmp jnb mov mov mov mov mov push mov push mov call push call add push push mov push mov push call add mov mov sub mov sbb mov mov mov push mov call jmp mov push call add movzx,sub_41E580,60.0,8.0,12.0,82.0,d718fb9806b220bc1fa1351aff5c127a845805ec,131464a15716cf0a77c9f0c379003dc262f146dd,jcnd goto goto jz cli cmp sar sal daa jmp mov in dec rcr adc enter dec jnb retn xor scas pop pop inc mov xchg retn mov mov call mov mov setb seto sub setz setp sets mov add mov ldx mov cfshr sar und setz setp sets stx mov mov ldx cfshl shl und setz setp sets stx ext mov mov nop pop ofadd add setz setp sets mov mov mov stx mov mov mov nop pop mov,both,patched,578.0,253.0
4400032,"protected: virtual class std::ostreambuf_iterator<unsigned short,struct std::char_traits<unsigned short>> std::num_put<unsigned short,class std::ostreambuf_iterator<unsigned short,struct std::char_traits<unsigned short>>>::do_put(class std::ostreambuf_iterator<unsigned short,struct std::char_traits<unsigned short>>,class std::ios_base near &,unsigned short,double)const",328.0,17.0,44.0,585.0,351d2df0253f7f0f7353e1821f58a3502a67458b,56c4184d40afeae7f5fc3f2b7d68630946ebeb17,jcnd jcnd jcnd jcnd jcnd jcnd jcnd jcnd push mov call mov mov mov and mov mov mov mov mov and and mov mov test jg jl test jnz cmp jz push pop xor fld mov mov cmp jnz fld fabs fcomp fnstsw test jnz lea push push push fstp call mov mov cdq add xor sub imul cdq idiv add push lea fstp push lea call cmp lea mov mov jb mov fld lea push push fstp push push,sub_4323A0,94.0,6.0,10.0,38.0,09739bff8303a2b1e69870aaf0b90068d64fddfa,718b22b8cd0e81bca6cdd15ece302ac3a89af68a,dec and int jge mov das mov mov stosd loop outsb in cmp idiv daa jmp retn xchg stc xor mov icebp cmp push cdq scasd mov cdq adc mov add enter push stosd stosb les inc jmp,both,patched,547.0,234.0
4202768,sub_402110,269.0,23.0,64.0,559.0,f1041ce997eef8b906c04c09a421de3bba327934,9f2d1a7ef73a1f8bfda20723eae4b3bc9ee991b1,jcnd goto jcnd goto jcnd jcnd goto jcnd goto jcnd goto jcnd jcnd jcnd goto jcnd goto mov mov mov mov und und mov mov mov sub stx mov mov add ldx mov setb seto sub setz setp sets mov mov xor mov mov mov mov sub stx mov mov mov mov mov mov sub stx mov mov sub ldx mov mov mov mov sub stx mov mov sub ldx mov setb seto sub setz setp sets mov mov lnot,sub_402110,17.0,4.0,6.0,35.0,748f6cdf111261cbea6bfe17dce48e8686b40f52,6835f41d6760f6736861197f9db886a0ff0ab3ed,jcnd goto goto mov mov call mov mov setb seto sub setz setp sets ext mov mov add ldx xdu add setb seto sub setz setp sets mov mov jz cli cmp insb sbb mov,both,patched,524.0,252.0
4400320,"protected: virtual class std::ostreambuf_iterator<unsigned short,struct std::char_traits<unsigned short>> std::num_put<unsigned short,class std::ostreambuf_iterator<unsigned short,struct std::char_traits<unsigned short>>>::do_put(class std::ostreambuf_iterator<unsigned short,struct std::char_traits<unsigned short>>,class std::ios_base near &,unsigned short,long double)const",328.0,17.0,44.0,585.0,351d2df0253f7f0f7353e1821f58a3502a67458b,8f3c948ff1653a20bf56b9d361b0194ee6d74bfc,jcnd jcnd jcnd jcnd jcnd jcnd jcnd jcnd push mov call mov mov mov and mov mov mov mov mov and and mov mov test jg jl test jnz cmp jz push pop xor fld mov mov cmp jnz fld fabs fcomp fnstsw test jnz lea push push push fstp call mov mov cdq add xor sub imul cdq idiv add push lea fstp push lea call cmp lea mov mov jb mov fld lea push push fstp push push,sub_4324C0,152.0,12.0,24.0,64.0,271d91af2e0c08352898eb448842f45daa52a4d5,1275558d333f3840fc131b77512a9c34c9ea86dc,adc lodsb mov xchg imul arpl mov inc outsd jb sti or jns sbb push insd or call jmp dec and in jle mov das mov mov stosd loop outsb in cmp idiv daa jmp arpl lodsb mov fcmovb dec inc retf retn xchg stc xor mov icebp cmp push cdq scasd mov cdq adc mov add enter push stosd stosb les inc jmp,both,patched,521.0,176.0
4752240,sub_488370,672.0,26.0,54.0,671.0,cba8174aad8d743b679a93d429a94ba464ddaab4,aed1aad75d748dda758dfb2ee9f72e3cbc3b3f22,jcnd goto jcnd jcnd jcnd jcnd goto jcnd mov mov mov mov und und mov mov und und und mov mov mov sub stx mov mov mov mov sub stx mov mov mov mov sub stx mov nop push mov sub mov mov nop nop mov mov call mov mov mov mov sub stx mov nop nop mov mov call mov and mov mov setz setp sets mov mov mov mov mov mov sub stx mov nop push mov sub,sub_488370,691.0,31.0,64.0,164.0,b3de0a602dd1f6e3595b47c098a3a320f1dcddf2,0b230412e11a55ca1b2f7d9e2a6ef866f5011bc9,jz cli mov adc popa scasd jb scasb fcmovb lds cli push mov push push mov push sub mov xor mov push lea mov mov mov mov push lea call mov call test jz mov push lea call mov mov mov mov mov or mov lea call push push push push lea push push mov call push call add mov jmp mov mov mov and jz and lea call lea call push call test jnz push push lea call push,both,patched,507.0,19.0
4754672,sub_488CF0,364.0,15.0,34.0,540.0,83a30715eb1708e4aecb5f495c5569232e802cfa,144749006852419e93c9e390a918bb768daf5720,jcnd goto jcnd goto jcnd goto jcnd jcnd mov mov mov mov und und mov mov und und und mov mov mov sub stx mov mov mov mov sub stx mov nop push mov sub mov mov nop nop mov mov call mov mov mov mov sub stx mov mov mov mov sub stx mov mov sub ldx mov mov mov add ldx mov setb seto sub setz setp sets mov mov lnot mov mov mov nop push mov mov,sub_488CF0,364.0,15.0,34.0,108.0,bff6d8e92cc92c0a582778a8d01f2a7b5cd7787b,8d9e4e30ec5c46170e8895296796c2614e1bb484,push mov push push mov push sub mov xor push lea mov mov mov push lea call mov mov mov cmp jnz jmp push mov mov push call mov cmp jnz jmp mov xor mov mov mul seto neg or push call add mov mov mov mov shl push push mov push call add lea push mov push mov mov mov call call add test jz jmp xor jnz cmp jz mov push lea call mov mov mov push call,both,patched,432.0,0.0
4764752,sub_48B450,385.0,9.0,16.0,533.0,21f9c9ba87d05e1bc1566cc9b0bec4576aa25c4a,a2ae3f41e6c2d298dc9593c3b5a2b2f010785d1b,jcnd jcnd mov mov mov mov und und mov mov und und und mov mov mov sub stx mov mov sub ldx mov mov nop nop mov mov call mov mov sub ldx mov mov mov add ldx mov setb seto sub setz setp sets mov mov mov mov sub ldx mov mov mov add ldx mov nop push mov nop push mov nop push mov mov sub ldx mov mov mov add ldx mov nop push mov nop nop,sub_48B450,385.0,9.0,16.0,113.0,d9d31514c03201b2ad4cc59f742ac872cbfb718e,c0c890ab369ba52cf1257dd8c7bf47b4883f0471,push mov push push mov push sub push mov xor push lea mov mov mov call mov cmp jz mov mov push push push mov mov push call mov mov push push push mov mov push call lea call mov mov mov push push lea push call mov call lea call test jle lea call push mov add mov mov mov mov mov call mov call push call mov call mov mov mov mov mov call mov call mov call,both,patched,420.0,0.0
4355984,sub_427790,104.0,5.0,8.0,96.0,a20a9ea148afa1e167e401dc7dc067364c6fb9b5,8d3a5f5aecaed2a93d54cc413b369707f3972efe,jcnd push mov push push mov push push mov xor push lea mov mov movzx test jz push mov push call add mov mov pop mov pop retn mov mov mov und und und mov mov mov sub stx mov mov add ldx xdu mov and mov mov setz setp sets mov mov mov nop push mov mov sub ldx mov nop push mov nop nop mov mov call mov cfadd ofadd add setz setp sets mov mov mov sub,sub_427790,186.0,27.0,58.0,514.0,f142d0756e018764f0f5bc442e991eb8b8689dee,46308434f634372b6b05e06d830f49bff2a08ca0,jcnd jcnd jcnd jcnd jcnd goto jcnd goto jcnd goto jcnd goto goto jcnd jcnd jcnd goto jcnd goto goto goto loop frstor cmpsb retf pop jmp add jz cli loop sar into sahf add call std cli arpl mov push jnb ja lds xor jle xchg mov mov add xchg das rol mov push jnp fistp scasd into push adc cmp cli scasb add jz cli mov xor scasb fcmovb lds scasd stosb xor sbb lahf pop jnp xchg,both,patched,418.0,82.0
4308064,sub_41BC60,26.0,1.0,0.0,44.0,cd9c8c093237ea06eb1ed82bb4f0c602d98ca7be,5de1ef4a16a419e7d0b5c612cc5ce96fe92cb77f,push mov push mov mov mov mov mov mov mov pop retn mov mov mov mov sub stx mov mov add ldx mov mov mov sub ldx mov mov mov add ldx mov mov mov mov stx mov mov nop pop mov add icall,sub_41BC60,165.0,20.0,40.0,451.0,8113a48ca46aa6836fdc8946b85280fe8e1fee8e,f6fbd373083aa8add92c65cf7f2d5919b581dd53,jcnd jcnd jcnd goto jcnd goto jcnd jcnd jcnd jcnd goto jcnd goto aas fst mov xlat dec call fcmovb retn cmp aaa das rol insb retf push jnp les cmp cmp jecxz mov fcmovb js cmc bts mov mov add in sti call cmp xchg das shl cmp retn jz cli xchg das rol mov jp xor sahf mov pop jbe mov scasb add mov adc scasb out push cli scasb add in sti call cmp aaa sbb cmp,both,patched,407.0,139.0
4252704,sub_40E420,28.0,1.0,0.0,55.0,30c9616fa3739a46f0dbef7542019d691d2c2363,bb2814f7a991e8052a9d681d0915c947315ded9e,mov mov mov add ldx mov nop push mov mov add ldx mov nop push mov mov add ldx mov nop push mov mov add ldx mov mov nop nop mov mov call mov mov add ldx mov nop pop mov icall push mov mov push mov push mov push mov call mov pop retn,sub_40E420,197.0,44.0,98.0,460.0,5499ab48b2f667d29fb2976a57fa11bbf9bdb1d9,aa12056f7c98f7e069c3e1666d72bd7a2a165a08,jcnd jcnd jcnd goto jcnd goto jcnd goto jcnd jcnd jcnd jcnd jcnd jcnd goto jcnd jcnd jcnd jcnd jcnd jcnd jcnd jcnd goto goto goto goto goto goto goto goto goto mov mov mov mov mov nop push mov mov add ldx cfshr shr und setz setp sets stx mov mov setb seto sub setz setp sets mov mov mov stx call call mov nop nop mov nop nop mov mov icall mov mov setb seto sub setz setp,both,patched,405.0,169.0
4359440,?clear@?$deque@PBVShader@@V?$allocator@PBVShader@@@std@@@std@@QAEXXZ_11,88.0,3.0,2.0,61.0,336caf1f6ac9779493039d39ad7e6f156683598e,8bdd8f8e60358faf696ec52efe13ee18e97e85db,push mov push push mov push push mov xor push lea mov mov mov call mov mov pop mov pop retn mov mov mov und und und mov mov mov sub stx mov mov sub ldx mov mov nop nop mov mov call mov mov sub ldx mov nop pop nop pop mov icall mov lea mov xor call mov jmp,sub_428510,187.0,17.0,34.0,453.0,df880b69d75b5489fa24a6ffe4db3f9a8b41b58f,c58f541b5b5b7a82ffc3813a5ee7c03002d55e97,jcnd jcnd jcnd goto jcnd jcnd jcnd jcnd goto goto goto goto goto adc scasb fcmovb lds cli into dec xchg inc sbb fld scasd into mov arpl xchg insd mov call pop push fimul push mov xchg sbb sub xchg mov aad pushf mov push jnp fild int in and jle stosb add xchg retf mov add cdq scasd pop jnp jno fld jz cli mov xor scasb fcmovb lds scasd stosb xor sbb lahf pop jnp xchg jnp,both,patched,392.0,99.0
4215632,sub_405350,28.0,1.0,0.0,46.0,c3aa9c96ca2016a3ea020c809ac8d8f5416490b3,47173119186b75a664ea8b92f3c816c12fc7872d,push mov push mov mov push mov call mov mov pop retn mov mov mov mov sub stx mov mov add ldx mov nop push mov mov sub ldx mov mov nop nop mov mov call mov mov sub ldx mov nop pop mov add icall,sub_405350,151.0,24.0,48.0,389.0,444555f2cea3d70c4ec96b6709a7172b61b2e9ce,77a300f43aacde02eb1983567b3cc719298164d0,jcnd jcnd goto jcnd jcnd jcnd jcnd jcnd goto jcnd jcnd jcnd jcnd jcnd jcnd goto goto goto goto goto goto goto jz cli xchg das rol mov push jnp lodsb lds or js pop push mov aad push shr cmp mov jz cli xchg das rol retf add jz cli cmp sbb arpl sal jle adc mov mov clc adc scasb fcmovb jbe mov fcmovb retn add xchg mov jle xor pop jnp arpl leave cmps loop lahf loop,both,patched,343.0,123.0
4213952,sub_404CC0,72.0,1.0,0.0,143.0,42616c6efd571c2513c06444018052ecdf75d65a,9f3510b4ac60b13b1984273a7a34b81f2bf92f08,push mov sub mov mov mov push mov mov push mov mov push mov mov push mov push mov mov mov mov mov call mov call mov pop retn mov mov mov mov und und mov mov mov sub stx mov mov add ldx mov mov mov add ldx mov nop push mov mov add ldx mov mov mov add ldx mov nop push mov mov add ldx mov mov mov ldx mov nop push mov mov add ldx mov,sub_404CC0,177.0,39.0,84.0,479.0,ff647d9977c1def55f897b103cdd5a13817e7ac5,dffd8a1ca557345a7bdaf81edf6f76e33b1eb844,jcnd jcnd jcnd goto jcnd goto jcnd jcnd jcnd jcnd jcnd goto jcnd jcnd jcnd jcnd jcnd jcnd jcnd jcnd goto goto goto goto goto goto goto goto jz cli cmp popf cmp sar cmpsb ficom loop retn rol jz pop sbb sti call pop jbe cli scasb add jz cli cmp popf cmp sal cmp sar mov push jnp les jno dec jnb les mov scasb jnz mov insb mov push mov ja dec jnp les mov scasb jnz,both,patched,336.0,105.0
4307632,sub_41BAB0,16.0,1.0,0.0,20.0,5baf88e76b12dfa4808dee3b8e6f923cb8beea3d,1ed6330a52c3fbf5f00091a8bbea3ec6d39003ad,push mov push mov mov mov pop retn mov mov mov mov sub stx mov mov nop pop mov icall,sub_41BAB0,149.0,12.0,26.0,344.0,6aa3dcb273d10db53b5df3aeaf976c9efcf8e80c,97ca19258b9936458f2c1aca12ca042284e7a671,jcnd goto goto jcnd jcnd jcnd jcnd jcnd jcnd goto goto jz cli xchg das ror cmp xchg and xchg mov sbb into stosb jmp aad call les jnp adc rcr cmp sub or add mov les jnp jno push cli scasb add in sti call cmp mov adc scasb fcmovb lds bound jge sbb imul mov dec fcmovb retn mov mov call mov mov ldx mov ext mov mov sub ldx cfshr mov mov und stx mov mov setb,both,patched,324.0,133.0
4224576,sub_407640,19.0,1.0,0.0,30.0,ae1174006b347ec797ef6424b05196d3ee31fb39,1e055b74dba0555a48afc3f68db11abeeac78bcb,push mov push mov mov call mov pop retn mov mov mov mov sub stx mov mov sub ldx mov mov nop nop mov mov call nop pop mov icall,sub_407640,132.0,15.0,36.0,338.0,8408606546175fde0e25ddbfbfd59e7b2c663986,4022946ee0d200cc63deecb177f756d10437c497,jcnd jcnd jcnd jcnd jcnd goto goto jcnd goto jz cli xchg das rol insb retf call cmp mov cmp popa scasd jb scasb fcmovb lds cli fimul inc sbb fld scasd into mov arpl jge fcmovb js cmp mov jno cmp scasb fcmovb or push mov mov scasb jno aad mov pop lds add test sbb push sbb test jmp mov mov call mov mov ldx mov ext cfshl mov mov und ext nop pop ldx add ijmp mov,both,patched,308.0,113.0
4798768,sub_493930,10.0,2.0,2.0,7.0,412dff1c0e2ab69eff8e722b3c990f4e9bcd469e,534a2ba58764948d101e370ad113dc4c2c54624b,mov mov mov mov call mov jmp,sub_493930,126.0,18.0,38.0,299.0,d0cddd9f0215cb7f73cf9ef53ce8a3c69514149b,7187494b625f26775480e9cf68e51e169acb1823,goto jcnd jcnd jcnd jcnd jcnd jcnd jz jcnd jcnd goto goto goto goto goto goto jz cli mov and scasd jb scasb fcmovb lds cli fisubr scasd and fld into mov fcmovb js cmp xor cmpsd pop xchg mov jbe push out inc mov les mov scasb jnz mov aaa daa out xorps imul scasd jno loope loop mov insb adc retf mov mov call mov mov mov mov sub ldx mov and mov mov setz setp sets stx,both,patched,292.0,116.0
4234752,sub_409E00,25.0,1.0,0.0,43.0,7e2ed907c244ee908c231754ccfcdf79d428266a,da09e6c987dfa9cd4960638818a9ea8b46e233e4,push mov push mov mov push call add mov pop retn mov mov mov mov sub stx mov mov add ldx mov nop push mov nop nop mov mov call mov cfadd ofadd add setz setp sets mov nop pop mov add icall,sub_409E00,131.0,11.0,22.0,329.0,ef3076e996dba33c40b61721cd9fafe07cacb58c,b9d62d2a8aabcf0f64cbdc58ef40ea53bc9a93c8,jcnd jcnd jcnd goto jcnd jcnd goto jz cli xchg das rol mov inc pusha into lds rcl jg leave cdq sti call cmp xchg das rol insb retf mov jz cli xchg das rol retf sti call cmp dec hlt mov scasd xchg cmp jle mov das sar pushf mov hnt jbe push adc leave cdq sti call sti call cmp xchg das rol insb retf mov mov call mov mov ldx mov ext cfshl mov mov und mov mov,both,patched,286.0,106.0
